ID,"Joke"
1118,Wir wollen den Pflegeberuf attraktiver machen, etwa mit Steuerbefreiungvon Zuschlägen, durch die Abschaffung geteilter Dienste, die Einführung trägereigener Springerpools 82und einen Anspruch auf familienfreundliche Arbeitszeiten für Menschen mit betreuungspflichtigenKindern.Wir harmonisieren die Ausbildungen u. a. durch bundeseinheitliche Berufsgesetze für Pflegeassistenz,Hebammenassistenz und Rettungssanitärer und sorgen für eine gemeinsame Finanzierung von Bundund Ländern.
1119,Die akademische Pflegeausbildung stärken wir gemeinsam mit den Ländern.
1120,Dort, woPflegefachkräfte in Ausbildung oder Studium bisher keine Ausbildungsvergütung erhalten, schließenwir Regelungslücken.
1121,Professionelle Pflege ergänzen wir durch heilkundliche Tätigkeiten und schaffenu.
1122,a. das neue Berufsbild der „Community Health Nurse“.Wir bringen ein allgemeines Heilberufegesetz auf den Weg und entwickeln das elektronischeGesundheitsberuferegister weiter.
1123,Wir machen Schmerzmittel im Betäubungsmittelgesetz fürGesundheitsberufe delegationsfähig.
1124,Wir bringen ein Modellprojekt zum Direktzugang fürtherapeutische Berufe auf den Weg.Wir vereinfachen und beschleunigen die notwendige Gewinnung von ausländischen Fachkräften unddie Anerkennung von im Ausland erworbener Berufsabschlüsse.Mit einer bundesweiten Befragung aller professionell Pflegenden wollen wir Erkenntnisse darübererlangen, wie die Selbstverwaltung der Pflege in Zukunft organisiert werden kann.
1125,Wir stärken denDeutschen Pflegerat als Stimme der Pflege im Gemeinsamen Bundesausschuss und anderen Gremienund unterstützen ihn finanziell bei der Wahrnehmung seiner Aufgaben.Aus- und Weiterbildung in Gesundheit und PflegeIm Rahmen der Reform der Krankenhausvergütung werden Mittel für Weiterbildung in denFallpauschalen künftig nur an die Kliniken anteilig ausgezahlt, die weiterbilden.
1126,Wir aktualisieren dasKonzept zur Fortentwicklung der Qualifizierung von Ärztinnen und Ärzten, um auch medikamentöseSchwangerschaftsabbrüche leichter verfügbar zu machen.
1127,Wir implementieren die Vermittlungdigitaler Kompetenzen in der Ausbildung der Gesundheits- und Pflegeberufe sowie in Fort- undWeiterentwicklung.
1128,Die Pflegeausbildung soll in Einrichtungen der Eingliederungshilfe und derRehabilitation ermöglicht werden, soweit diese die Voraussetzungen erfüllen.
1129,DieApprobationsordnung wird mehr auf Digitalisierung, Ambulantisierung, Spezialisierung,Individualisierung und berufsgruppenübergreifende Kooperation ausgerichtet.
1130,83Öffentlicher GesundheitsdienstAls Lehre aus der Pandemie bedarf es eines gestärkten Öffentlichen Gesundheitsdienstes (ÖGD), derim Zusammenspiel zwischen Bund, Ländern und Kommunen sichergestellt wird.
1131,Wir verlängern beimPakt für den ÖGD die Einstellungsfristen und appellieren an die Sozialpartner, einen eigenständigenTarifvertrag zu schaffen.
1132,Auf der Grundlage des Zwischenberichts stellen wir die notwendigen Mittelfür einen dauerhaft funktionsfähigen ÖGD bereit.
1133,Mit einem Gesundheitssicherstellungsgesetz stellenwir insbesondere die effiziente und dezentrale Bevorratung von Arzneimittel- und Medizinproduktensowie regelmäßige Ernstfallübungen für das Personal für Gesundheitskrisen sicher.
1134,Zur weiterenErforschung und Sicherstellung einer bedarfsgerechten Versorgung rund um die Langzeitfolgen vonCovid19 sowie für das chronische Fatigue-Syndrom (ME/CFS) schaffen wir ein deutschlandweitesNetzwerk von Kompetenzzentren und interdisziplinären Ambulanzen.Die Bundeszentrale für gesundheitliche Aufklärung geht in einem Bundesinstitut für öffentlicheGesundheit am Bundesministerium für Gesundheit auf, in dem die Aktivitäten im Public-HealthBereich, die Vernetzung des ÖGD und die Gesundheitskommunikation des Bundes angesiedelt sind.Das RKI soll in seiner wissenschaftlichen Arbeit weisungsungebunden sein.Digitalisierung im GesundheitswesenIn einer regelmäßig fortgeschriebenen Digitalisierungsstrategie im Gesundheitswesen und in derPflege legen wir einen besonderen Fokus auf die Lösung von Versorgungsproblemen und diePerspektive der Nutzerinnen und Nutzer.
1135,In der Pflege werden wir die Digitalisierung u. a. zurEntlastung bei der Dokumentation, zur Förderung sozialer Teilhabe und für therapeutischeAnwendungen nutzen.
1136,Wir ermöglichen regelhaft telemedizinische Leistungen inklusive Arznei-, Heilund Hilfsmittelverordnungen sowie Videosprechstunden, Telekonsile, Telemonitoring und dietelenotärztliche Versorgung.Wir beschleunigen die Einführung der elektronischen Patientenakte (ePA) und des E-Rezeptes sowiederen nutzenbringende Anwendung und binden beschleunigt sämtliche Akteure an dieTelematikinfrastruktur an.
1137,Alle Versicherten bekommen DSGVO-konform eine ePA zur Verfügunggestellt; ihre Nutzung ist freiwillig (opt-out).
1138,Die gematik bauen wir zu einer digitalenGesundheitsagentur aus.
1139,Zudem bringen wir ein Registergesetz und einGesundheitsdatennutzungsgesetz zur besseren wissenschaftlichen Nutzung in Einklang mit der DSGVOauf den Weg und bauen eine dezentrale Forschungsdateninfrastruktur auf.
1140,84Wir überprüfen das SGB V und weitere Normen hinsichtlich durch technischen Fortschritt überholterDokumentationspflichten.
1141,Durch ein Bürokratieabbaupaket bauen wir Hürden für eine guteVersorgung der Patientinnen und Patienten ab.
1142,Die Belastungen durch Bürokratie undBerichtspflichten jenseits gesetzlicher Regelungen werden kenntlich gemacht.
1143,Wir verstetigen dieVerfahrenserleichterungen, die sich in der Pandemie bewährt haben.
1144,Sprachmittlung auch mit Hilfedigitaler Anwendungen wird im Kontext notwendiger medizinischer Behandlung Bestandteil desSGB V.GesundheitsförderungWir entwickeln das Präventionsgesetz weiter und stärken die Primär- und Sekundärprävention.
1145,DemLeitgedanken von Vorsorge und Prävention folgend stellen wir uns der gesamtgesellschaftlichenAufgabe zielgruppenspezifisch und umfassend.
1146,Wir unterstützen die Krankenkassen und andereAkteure dabei, sich gemeinsam aktiv für die Gesunderhaltung aller einzusetzen.
1147,Wir schaffen einenNationalen Präventionsplan sowie konkrete Maßnahmenpakete z.B.
1148,zu den Themen Alterszahngesundheit, Diabetes, Einsamkeit, Suizid, Wiederbelebung und Vorbeugung von klima- undumweltbedingten Gesundheitsschäden.
1149,Zu Gunsten verstärkter Prävention und Gesundheitsförderungreduzieren wir die Möglichkeiten der Krankenkassen, Beitragsmittel für Werbemaßnahmen undWerbegeschenke zu verwenden.Ambulante und stationäre GesundheitsversorgungUm die Ambulantisierung bislang unnötig stationär erbrachter Leistungen zu fördern, setzen wir zügigfür geeignete Leistungen eine sektorengleiche Vergütung durch sogenannte Hybrid-DRG um.
1150,Durchden Ausbau multiprofessioneller, integrierter Gesundheits- und Notfallzentren stellen wir einewohnortnahe, bedarfsgerechte, ambulante und kurzstationäre Versorgung sicher und fördern diesedurch spezifische Vergütungsstrukturen.
1151,Zudem erhöhen wir die Attraktivität vonbevölkerungsbezogenen Versorgungsverträgen (Gesundheitsregionen) und weiten den gesetzlichenSpielraum für Verträge zwischen Krankenkassen und Leistungserbringern aus, um innovativeVersorgungsformen zu stärken.
1152,In besonders benachteiligten Kommunen und Stadtteilen (5 Prozent)errichten wir niedrigschwellige Beratungsangebote (z.B.
1153,Gesundheitskioske) für Behandlung undPrävention.
1154,Im ländlichen Raum bauen wir Angebote durch Gemeindeschwestern undGesundheitslotsen aus.
1155,Die ambulante Bedarfs- und stationäre Krankenhausplanung entwickeln wirgemeinsam mit den Ländern zu einer sektorenübergreifenden Versorgungsplanung weiter.Die Notfallversorgung soll in integrierten Notfallzentren in enger Zusammenarbeit zwischen denkassenärztlichen Vereinigungen (KV) und den Krankenhäusern (KH) erfolgen.
1156,Wir räumen den KVen 85die Option ein, die ambulante Notfallversorgung dort selbst sicherzustellen oder diese Verantwortungin Absprache mit dem Land ganz oder teilweise auf die Betreiber zu übertragen.
1157,Durch eineVerschränkung der Rettungsleitstellen mit den KV-Leitstellen und standardisiertenEinschätzungssystemen (telefonisch, telemedizinisch oder vor Ort) erreichen wir einebedarfsgerechtere Steuerung.
1158,Wir nehmen das Rettungswesen als integrierten Leistungsbereich in dasSGB V auf und regeln den Leistungsumfang der Bergrettung sowie die Verantwortung fürWasserrettung jenseits der Küstengewässer.Wir stellen gemeinsam mit den KVen die Versorgung in unterversorgten Regionen sicher.
1159,Wir hebendie Budgetierung der ärztlichen Honorare im hausärztlichen Bereich auf.
1160,Die Gründung von kommunalgetragenen Medizinischen Versorgungszentren und deren Zweigpraxen erleichtern wir und bauenbürokratische Hürden ab.
1161,Entscheidungen des Zulassungsausschusses müssen künftig durch diezuständige Landesbehörde bestätigt werden.Die Arzneimittelversorgung durch Apotheken an integrierten Notfallzentren in unterversorgtenGebieten verbessern wir durch flexiblere Vorgaben in der Apothekenbetriebsordnung.
1162,Wir entwickelnden Nacht- und Notdienstfonds zu einem Sicherstellungsfonds weiter und schaffen eineVerordnungsfähigkeit für Notfallbotendienste in der ambulanten Notfallversorgung.
1163,Wir novellierendas „Gesetz zur Stärkung der Vor-Ort-Apotheken“, um pharmazeutische Dienstleistungen besser zuhonorieren und Effizienzgewinne innerhalb des Finanzierungssystems zu nutzen.Wir setzen das Nationale Gesundheitsziel „Gesundheit rund um die Geburt“ mit einem Aktionsplanum.
1164,Wir evaluieren mögliche Fehlanreize rund um Spontangeburten und Kaiserschnitte und führeneinen Personalschlüssel für eine 1:1-Betreuung durch Hebammen während wesentlicher Phasen derGeburt ein.
1165,Wir stärken den Ausbau hebammengeleiteter Kreißsäle und schaffen die Möglichkeit undVergütung zur ambulanten, aufsuchenden Geburtsvor- und -nachsorge für angestellte Hebammen anKliniken.Für ein diverses, inklusives und barrierefreies Gesundheitswesen erarbeiten wir mit den Beteiligten bisEnde 2022 einen Aktionsplan, stärken die Versorgung schwerstbehinderter Kinder und entlasten ihreFamilien von Bürokratie.
1166,Die Medizinischen Behandlungszentren für Erwachsene mit geistigerBehinderung oder schweren Mehrfachbehinderungen sowie die Sozialpädiatrischen Zentren bauen wirin allen Bundesländern aus.
1167,86Wir berücksichtigen geschlechtsbezogene Unterschiede in der Versorgung, bei Gesundheitsförderungund Prävention und in der Forschung und bauen Diskriminierungen und Zugangsbarrieren ab.
1168,DieGendermedizin wird Teil des Medizinstudiums, der Aus-, Fort- und Weiterbildungen derGesundheitsberufe werden.Wir stärken die paritätische Beteiligung von Frauen in den Führungsgremien derKassen(zahn)ärztlichen Vereinigungen sowie ihrer Spitzenverbände auf Bundesebene sowie dergesetzlichen Krankenkassen.Wir starten eine bundesweite Aufklärungskampagne zur Entstigmatisierung psychischerErkrankungen.
1169,Wir reformieren die psychotherapeutische Bedarfsplanung, um Wartezeiten auf einenBehandlungsplatz, insbesondere für Kinder- und Jugendliche, aber auch in ländlichen undstrukturschwachen Gebieten deutlich zu reduzieren.
1170,Wir verbessern die ambulantepsychotherapeutische Versorgung insbesondere für Patienten mit schweren und komplexenErkrankungen und stellen den Zugang zu ambulanten Komplexleistungen sicher.
1171,Die Kapazitätenbauen wir bedarfsgerecht, passgenau und stärker koordiniert aus.
1172,Im stationären Bereich sorgen wirfür eine leitliniengerechte psychotherapeutische Versorgung und eine bedarfsgerechtePersonalausstattung.
1173,Die psychiatrische Notfall- und Krisenversorgung bauen wir flächendeckend aus.Krankenhausplanung und -finanzierungMit einem Bund-Länder-Pakt bringen wir die nötigen Reformen für eine moderne und bedarfsgerechteKrankenhausversorgung auf den Weg.
1174,Eine kurzfristig eingesetzte Regierungskommission wird hierzuEmpfehlungen vorlegen und insbesondere Leitplanken für eine auf Leistungsgruppen undVersorgungsstufen basierende und sich an Kriterien wie der Erreichbarkeit und der demographischenEntwicklung orientierende Krankenhausplanung erarbeiten.
1175,Sie legt Empfehlungen für eineWeiterentwicklung der Krankenhausfinanzierung vor, die das bisherige System um ein nachVersorgungsstufen (Primär-, Grund-, Regel-, Maximalversorgung, Uniklinika) differenziertes Systemerlösunabhängiger Vorhaltepauschalen ergänzt.
1176,Kurzfristig sorgen wir für eine bedarfsgerechteauskömmliche Finanzierung für die Pädiatrie, Notfallversorgung und Geburtshilfe.Rechte von Patientinnen und PatientenDie Unabhängige Patientenberatung (UPD) überführen wir in eine dauerhafte, staatsferne undunabhängige Struktur unter Beteiligung der maßgeblichen Patientenorganisationen.
1177,87Mit einer Reform des G-BA beschleunigen wir die Entscheidungen der Selbstverwaltung, stärken diePatientenvertretung und räumen der Pflege und anderen Gesundheitsberufen weitereMitsprachemöglichkeiten ein, sobald sie betroffen sind.
1178,Der Innovationsfonds wird verstetigt.
1179,Fürerfolgreiche geförderte Projekte, wie die der Patientenlotsen werden wir einen Pfad vorgeben, wiediese in die Regelversorgung überführt werden können.Bei Behandlungsfehlern stärken wir die Stellung der Patientinnen und Patienten im bestehendenHaftungssystem.
1180,Ein Härtefallfonds mit gedeckelten Ansprüchen wird eingeführt.Versorgung mit Arzneimitteln und ImpfstoffenWir stellen die Versorgung mit innovativen Arzneimitteln und Impfstoffen sicher.
1181,Die Engpässe in derVersorgung bekämpfen wir entschieden.
1182,Wir ergreifen Maßnahmen, um die Herstellung vonArzneimitteln inklusive der Wirk- und Hilfsstoffproduktion nach Deutschland oder in die EU zurück zuverlagern.
1183,Dazu gehören der Abbau von Bürokratie, die Prüfung von Investitionsbezuschussungen fürProduktionsstätten, sowie die Prüfung von Zuschüssen zur Gewährung der Versorgungssicherheit.
1184,UmInteressenkonflikte zu vermeiden, schaffen wir mehr Transparenz über finanzielle Zuwendungen anLeistungs- und Hilfsmittelerbringer.DrogenpolitikWir führen die kontrollierte Abgabe von Cannabis an Erwachsene zu Genusszwecken in lizenziertenGeschäften ein.
1185,Dadurch wird die Qualität kontrolliert, die Weitergabe verunreinigter Substanzenverhindert und der Jugendschutz gewährleistet.
1186,Das Gesetz evaluieren wir nach vier Jahren aufgesellschaftliche Auswirkungen.
1187,Modelle zum Drugchecking und Maßnahmen der Schadensminderungermöglichen und bauen wir aus.Bei der Alkohol- und Nikotinprävention setzen wir auf verstärkte Aufklärung mit besonderem Fokusauf Kinder, Jugendliche und schwangere Frauen.
1188,Wir verschärfen die Regelungen für Marketing undSponsoring bei Alkohol, Nikotin und Cannabis.
1189,Wir messen Regelungen immer wieder an neuenwissenschaftlichen Erkenntnissen und richten daran Maßnahmen zum Gesundheitsschutz aus.GesundheitsfinanzierungWir bekennen uns zu einer stabilen und verlässlichen Finanzierung der gesetzlichenKrankenversicherung (GKV).
1190,Den Bundeszuschuss zur GKV dynamisieren wir regelhaft.
1191,Wir finanzierenhöhere Beiträge für die Bezieherinnen und Bezieher von Arbeitslosengeld II aus Steuermitteln.
1192,Wirbehalten das bestehende Preismoratorium bei.
1193,Das Gesetz zur Neuordnung des Arzneimittelmarktes 88(AMNOG) entwickeln wir weiter.
1194,Wir stärken die Möglichkeiten der Krankenkassen zur Begrenzung derArzneimittelpreise.
1195,Der verhandelte Erstattungspreis gilt ab dem siebten Monat nach Markteintritt.Die gesetzlichen Krankenkassen sollen ihre Service- und Versorgungsqualität zukünftig anhand voneinheitlichen Mindestkriterien offenlegen.
1196,Sie erhalten verstärkt die Möglichkeit, ihren Versichertenauch monetäre Boni für die Teilnahme an Präventionsprogrammen zu gewähren.
1197,Für Kinder undJugendliche in der PKV soll zukünftig das Prinzip der Direktabrechnung gelten.Wir werden für Menschen mit ungeklärtem Versicherungsstatus, wie insbesondere Wohnungslose,den Zugang zur Krankenversicherung und zur Versorgung prüfen und im Sinne der Betroffenen klären.Bauen und WohnenWohnen ist ein Grundbedürfnis und so vielfältig wie die Menschen.
1198,Wir werden das Bauen undWohnen der Zukunft bezahlbar, klimaneutral, nachhaltig, barrierearm, innovativ und mit lebendigenöffentlichen Räumen gestalten.
1199,Dabei haben wir die Vielfalt der Rahmenbedingungen undWohnformen und individuellen Bedürfnisse der Menschen in ländlichen und urbanen Räumen im Blick.Dafür starten wir einen Aufbruch in der Bau-, Wohnungs- und Stadtentwicklungspolitik.
1200,Unser Ziel istder Bau von 400.000 neuen Wohnungen pro Jahr, davon 100.000 öffentlich geförderte Wohnungen.Dafür werden wir die finanzielle Unterstützung des Bundes für den sozialen Wohnungsbau inklusivesozialer Eigenheimförderung fortführen und die Mittel erhöhen.Wir werden ein „Bündnis bezahlbarer Wohnraum“ mit allen wichtigen Akteuren schließen.
1201,Wir werdenzeitnah eine neue Wohngemeinnützigkeit mit steuerlicher Förderung und Investitionszulagen auf denWeg bringen und so eine neue Dynamik in den Bau und die dauerhafte Sozialbindung bezahlbarenWohnraums erzeugen.
1202,Sie soll nach den Grundsätzen der Wirtschaftlichkeit die Struktur deretablierten Wohnungswirtschaft ergänzen, ohne diese zu benachteiligen.Wir legen ein Bund-Länderprogramm für studentisches Wohnen, für junges Wohnen und Wohnen fürAuszubildende auf.
1203,Wir werden eine Bau- und Investitionsoffensive starten, die die Voraussetzungenschafft schnell und günstig zusätzlichen Wohnraum zu schaffen und zu erhalten, und dadurch sowohlder Bau- und Immobilienwirtschaft langfristige Planungsperspektive als auch den Mieterinnen undMietern Sicherheit gibt.
1204,89Wir werden einen Bau-, Wohnkosten und Klimacheck einführen.
1205,Wir wollen Kommunen helfen,Potenzialflächenregister einzuführen.Wir setzen im Rahmen des Bündnisses die Arbeit der Baukostensenkungskommission fort.
1206,Wir gliederndie nicht bahnnotwendigen Immobilien des Bundeseisenbahnvermögens in die Bundesanstalt fürImmobilienaufgaben (BImA) ein und richten die BImA auf unsere bau-, wohnungs-,stadtentwicklungspolitischen und ökologischen Ziele aus.
1207,Wir werden der BImA mehr Freiheitenverschaffen und ihr die Aufnahme von Krediten ermöglichen.
1208,Die BImA soll künftig selbst investierenund bauen sowie weiterhin kommunales Bauen unterstützen können.
1209,Dazu wollen wir dieVerantwortung für Planung, Bau und Betrieb der Bundesbauten und Bundesliegenschaften bei derBImA konzentrieren.Wir werden unseren Einsatz für altersgerechtes Wohnen und Barriereabbau verstärken und die Mittelfür das KfW Programm auskömmlich aufstocken.Digitalisierung und VereinfachungWir werden durch serielles Bauen, Digitalisierung, Entbürokratisierung und Standardisierung dieKosten für den Wohnungsbau senken.
1210,Wir wollen modulares und serielles Bauen und Sanieren durchTypengenehmigungen beschleunigen.
1211,Wir wollen die Prozesse der Normung und Standardisierung soanpassen, dass Bauen günstiger wird.Wir werden die Bau- und Immobilienwirtschaft sowie alle Ebenen der Verwaltung unterstützen dieDigitalisierung zu meistern, Open-BIM und einheitliche Schnittstellen/Standards umzusetzen.
1212,DerBundesbau ist Vorbild bei der Digitalisierung und unseren bau-, wohnungs- und klimapolitischenZielen.Wir werden das Baugesetzbuch (BauGB) mit dem Ziel novellieren, seine Instrumente noch effektiverund unkomplizierter anwenden zu können, Klimaschutz und -anpassung, Gemeinwohlorientierung unddie Innenentwicklung zu stärken sowie zusätzliche Bauflächen zu mobilisieren und weitereBeschleunigungen der Planungs- und Genehmigungsverfahren vorzunehmen.
1213,Wir werden dieentsprechenden Regelungen im Baulandmobilisierungsgesetz entfristen und die rechtlichenGrundlagen für eine vollständige Digitalisierung der Bauleitplanverfahren schaffen.
1214,Wir werdenprüfen, ob sich aus dem Urteil des Bundesverwaltungsgerichts vom 9.
1215,November 2021 zum 90gemeindlichen Vorkaufsrecht in Gebieten einer Erhaltungssatzung (Milieuschutzsatzung)gesetzgeberischer Handlungsbedarf ergibt.
1216,Wir wollen die Bauforschung stärken.Klimaschutz im GebäudebereichIm Rahmen des Klimaschutzsofortprogramms führen wir 2022 nach dem Auslaufen derNeubauförderung für den KfW-Effizienzhausstandard 55 (EH 55) ein Förderprogramm für denWohnungsneubau ein, das insbesondere die Treibhausgas-Emissionen (THG-Emissionen) pro m²Wohnfläche fokussiert und ändern das Gebäudeenergiegesetz (GEG) wie folgt: Zum 1.
1217,Januar 2025 solljede neu eingebaute Heizung auf der Basis von 65 Prozent erneuerbarer Energien betrieben werden;zum 1.
1218,Januar 2024 werden für wesentliche Ausbauten, Umbauten und Erweiterungen vonBestandsgebäuden im GEG die Standards so angepasst, dass die auszutauschenden Teile dem EH 70entsprechen; im GEG werden die Neubau-Standards zum 1.
1219,Januar 2025 an den KfW-EH 40angeglichen.
1220,Daneben können im Rahmen der Innovationsklausel gleichwertige, dem Ziel der THGEmissionsreduzierung folgende Maßnahmen eingesetzt werden.Wir werden mit der Wohnungswirtschaft die begonnene Innovationspartnerschaft wieder aufgreifenund den Quartiersansatz und die Innovationsklausel fortschreiben.
1221,Wir heben die lineare Abschreibungfür den Neubau von Wohnungen von zwei auf drei Prozent an und behalten dabei dieunterschiedlichen Effekte auf die verschiedenen Bauherren im Blick.
1222,So starten wir die klimagerechteNeubauoffensive.Um eine wirtschaftlich effiziente, sozialverträgliche Umsetzung der Klimaschutzziele, insbesondereorientiert an der eingesparten Tonne CO2, sicherzustellen, setzen wir auf passgenaue undtechnologieoffene Maßnahmen aus Optimierung der Gebäudehülle, der technischen Anlagen zurErzeugung und Versorgung mit erneuerbarer Energie am Gebäude und Quartierslösungen.
1223,DieFörderprogramme werden wir den Zielen und Bedarfen entsprechend weiterentwickeln undumschichten.Wir werden die Grundlagen schaffen, den Einsatz grauer Energie sowie die Lebenszykluskostenverstärkt betrachten zu können.
1224,Dazu führen wir u. a. einen digitalen Gebäuderessourcenpass ein.
1225,Sowollen wir auch im Gebäudebereich zu einer Kreislaufwirtschaft kommen.
1226,Außerdem werden wir einenationale Holzbau-, Leichtbau- und Rohstoffsicherungsstrategie auflegen.
1227,Innovativen Materialien,Technologien und Start-ups wollen wir den Markteintritt und Zulassungen erleichtern.
1228,91In den Verhandlungen über das EU-Programm „Fit for 55“ unterstützen wir die Vorschläge der EUKommission im Gebäudesektor.
1229,Um das Mieter-Vermieter-Dilemma zu überwinden, prüfen wir einenschnellen Umstieg auf die Teilwarmmiete.
1230,Im Zuge dessen wird die Modernisierungsumlage fürenergetische Maßnahmen in diesem System aufgehen.
1231,Wir wollen eine faire Teilung des zusätzlich zuden Heizkosten zu zahlenden CO2-Preises zwischen den Vermietern einerseits und Mieterinnen undMietern andererseits erreichen.
1232,Wir wollen zum 1.
1233,Juni 2022 ein Stufenmodell nachGebäudeenergieklassen einführen, das die Umlage des CO2-Preises nach BEHG regelt.
1234,Sollte dieszeitlich nicht gelingen, werden die erhöhten Kosten durch den CO2-Preis ab dem 1.
1235,Juni 2022 hälftigzwischen Vermieter und Mieterin bzw.
1236,Mieter geteilt.Wir streben eine breite, systematische Nutzung von Sanierungsfahrplänen an und werden diese z. B.für Wohnungseigentumsgemeinschaften und beim Kauf eines Gebäudes kostenlos machen.Wir werden serielles Sanieren vorantreiben, indem wir das Förderprogramm fortführen und innerhalbdes BEG ausweiten.
1237,Im Rahmen des Forschungsprogramms „Zukunft Bau“ werden wir serielles undmodulares Bauen und Sanieren z.
1238,B. nach dem niederländischen Energiesprong-Prinzipweiterentwickeln sowie bauplanungs- und bauordnungsrechtliche Hürden identifizieren undbeseitigen.
1239,Wir verbessern, vereinheitlichen und digitalisieren den Gebäudeenergieausweis.
1240,Wirwerden die Erstellung eines digitalen Gebäudeenergiekatasters prüfen.Wir werden das Wohngeld stärken, eine Klimakomponente einführen und kurzfristig einen einmaligerhöhten Heizkostenzuschuss zahlen.Schutz der Mieterinnen und MieterSolange nicht genug bezahlbare Wohnungen gebaut werden, verhindert die Wohnraumknappheit vorallem in Ballungsgebieten, dass sich angemessene Mieten am Wohnungsmarkt bilden können.
1241,Daherwerden wir die geltenden Mieterschutzregelungen evaluieren und verlängern.
1242,In angespanntenMärkten werden wir die Kappungsgrenze auf elf Prozent in drei Jahren absenken.
1243,Wir verlängern dieMietpreisbremse bis zum Jahre 2029.
1244,Wir werden qualifizierte Mietspiegel stärken, verbreitern undrechtssicher ausgestalten.
1245,Zur Berechnung sollen die Mietverträge der letzten sieben Jahreherangezogen werden.
1246,Wir werden für mehr Transparenz bei den Nebenkostenabrechnungen sorgen.Für Gemeinden über 100.000 Einwohnerinnen bzw.
1247,Einwohnern werden qualifizierte Mietspiegelverpflichtend.
1248,Wir werden ein Pilotprojekt starten, um in ausgesuchten Kommunen anhand vonAngaben in der Steuererklärung einen Mietspiegel zu erstellen.
1249,92Um die Ursachen drohender Wohnungslosigkeit zu beseitigen, werden wir das Mietrecht,insbesondere dort wo Schonfristzahlungen dem Weiterführen des Mietverhältnisses entgegenstehen,evaluieren und entgegensteuern.
1250,Wir setzen uns zum Ziel, bis 2030 Obdach- und Wohnungslosigkeitzu überwinden und legen einen Nationalen Aktionsplan dafür auf.WohneigentumWir wollen mehr Menschen in Deutschland ermöglichen, im selbstgenutzten Eigentum zu wohnen.
1251,DieHürden beim Eigentumserwerb wollen wir durch eigenkapitalersetzende Darlehen senken undSchwellenhaushalte langfristig z.
