ID,"Joke"
567,Wir werden fürTransparenz bei Ablassen von Kerosin sorgen und Möglichkeiten der Vermeidung entwickeln.Kommunen werden wir auf dem Weg zu besserer Luftqualität unterstützen.
568,BVT-Schlussfolgerungensetzen wir fristgerecht und nachhaltig um.
569,Um die Minderungsziele aus der Richtlinie über nationaleEmissionshöchstmengen fristgerecht zu erreichen, setzen wir im nationalen Luftreinhalteprogrammalle erforderlichen Maßnahmen um.BodenschutzDas Bundesbodenschutzrecht werden wir evaluieren und an die Herausforderungen desKlimaschutzes, der Klimaanpassung und den Erhalt der Biodiversität anpassen und dabei dieunterschiedlichen Nutzungen berücksichtigen.
570,Auf EU-Ebene werden wir uns für einen verbessertenSchutz der Böden und verbindliche Regelungen einsetzen.
571,Wir werden ein nationalesBodenmonitoringzentrum einrichten.
572,Um den Flächenverbrauch für Siedlungs- und Verkehrszwecke 42auf das 30-ha-Ziel bis spätestens 2030 zu reduzieren, werden wir Anreize setzen, Fehlanreizevermeiden und durch wirksame Initiativen Versiegelung reduzieren.ChemikalienpolitikDie Chemieindustrie steht in einem weltweiten Wettbewerb.
573,Wir stärken ihre Wettbewerbsfähigkeitund Innovationskraft, Nachhaltigkeit und Klimaschutz sowie den Produktionsstandort Deutschland,sichern Arbeitsplätze und reduzieren die Risiken des Einsatzes gesundheitsgefährdender Stoffe (z. B.Per- und Polyfluorierter Chemikalien).
574,Wir bringen uns entsprechend konstruktiv in die Debatte um dieEU-Chemikalienstrategie ein.
575,In diesem Sinne wollen wir REACH (EU-Verordnung zur Registrierung,Bewertung, Zulassung und Beschränkung chemischer Stoffe) weiterentwickeln; wobei Stoffe undStoffgruppen auf ihre Risiken hin bewertet werden.
576,Nach einer Risikobewertung im Kontext derAnwendung kann eine Zulassung erfolgen.
577,Wir erarbeiten einen nationalen Plan zum Schutz vorhormonaktiven Substanzen.
578,Wir schützen unsere Unternehmen sowie Verbraucher undVerbraucherinnen besser vor Importen, die den EU-Standards nicht entsprechen, indem wirgemeinsam mit den Ländern den Vollzug bei der Kontrolle stärken und Produktrückrufe erleichtern.Wir werden das Human-Biomonitoring stärken und eine kontinuierliche Finanzierung sicherstellen.
579,Füreine umfassende Bewertung von Stoffen und die Entwicklung von nachhaltigen Chemikalien stärkenwir die Forschung und den Produktionsstandort Deutschland.KreislaufwirtschaftWir fördern die Kreislaufwirtschaft als effektiven Klima- und Ressourcenschutz, Chance für nachhaltigeWirtschaftsentwicklung und Arbeitsplätze.
580,Wir haben das Ziel der Senkung des primärenRohstoffverbrauchs und geschlossener Stoffkreisläufe.
581,Hierzu passen wir den bestehenden rechtlichenRahmen an, definieren klare Ziele und überprüfen abfallrechtliche Vorgaben.
582,In einer „NationalenKreislaufwirtschaftsstrategie“ bündeln wir bestehende rohstoffpolitische Strategien.
583,Auf dieserGrundlage setzen wir uns in der EU für einheitliche Standards ein.
584,Anforderungen an Produkte müsseneuropaweit im Dialog mit den Herstellern ambitioniert und einheitlich festgelegt werden.
585,Produktemüssen langlebig, wiederverwendbar, recycelbar und möglichst reparierbar sein.
586,Wir stärken dieerweiterte Herstellerverantwortung auf europäischer Ebene.
587,Wir führen digitale Produktpässe ein,unterstützen Unternehmen bei der Umsetzung und wahren das Prinzip der Datensparsamkeit.
588,Wirstärken die Abfallvermeidung durch gesetzliche Ziele und ökologisch vorteilhafte Mehrweg-,Rücknahme- und Pfandsysteme sowie Branchenvereinbarungen.
589,Hierbei unterstützen wir innovative,nachhaltige Ideen wie geteilte Nutzung.
590,Wir etablieren ein Anreizsystem um bestimmte Elektrogeräteund gefährliche Lithium-Ionen-Batterien umweltgerecht zu entsorgen und der Kreislaufwirtschaftzuzuführen.
591,Die Retourenvernichtung werden wir reduzieren.
592,Mit einem gesetzlich verankerten 43Fondsmodell belohnen wir ressourcenschonendes und recyclingfreundliches Verpackungsdesignsowie den Rezyklateinsatz.
593,Wir führen ein Recycling-Label ein.
594,Mit einer Beschleunigung derEntwicklung von Qualitätsstandards für Rezyklate werden neue hochwertige Stoffkreisläufegeschaffen.
595,Qualitätsgesicherte Abfallprodukte sollen aus dem Abfallrecht entlassen werden undeinen Produktstatus erlangen.
596,Wir schreiben höhere Recyclingquoten und eine produktspezifischeMindestquote für den Einsatz von Rezyklaten und Sekundärrohstoffen auf europäischer Ebene fest.Wir nehmen chemisches Recycling im Verpackungsgesetz als Recyclingoption auf.
597,Wir setzen uns fürein europaweites Ende der Deponierung von Siedlungsabfällen ein.
598,Wir gehen mit den Ländernentschlossen gegen illegale Abfallexporte vor.
599,Der Export von Abfällen soll europarechtlich nur noch inzertifizierten Recyclinganlagen möglich sein.
600,Wir wollen ein Level-Playing-Field für Plastik-Rezyklate.Landwirtschaft und ErnährungEine nachhaltige Landwirtschaft dient zugleich den Interessen der Betriebe, des Tierwohls und derNatur und ist Grundlage einer gesunden Ernährung.TierschutzWir führen ab 2022 eine verbindliche Tierhaltungskennzeichnung ein, die auch Transport undSchlachtung umfasst.
601,Unser Ziel sind entsprechende verbindliche EU-weit einheitliche Standards.Zudem führen wir eine umfassende Herkunftskennzeichnung ein.
602,Wir begleiten die Einführung miteiner Informations- und Aufklärungskampagne.
603,Wir wollen die Landwirte dabei unterstützen, dieNutztierhaltung in Deutschland artgerecht umzubauen.
604,Dafür streben wir an, ein durchMarktteilnehmer getragenes finanzielles System zu entwickeln, mit dessen Einnahmenzweckgebunden die laufenden Kosten landwirtschaftlicher Betriebe ausgeglichen und Investitionengefördert werden ohne den Handel bürokratisch zu belasten.
605,Die Investitionsförderung wird künftignach den Haltungskriterien ausgerichtet und in der Regel nur nach den oberen Stufen gewährt.
606,DasBau- und Genehmigungsrecht ist entsprechend anzupassen.
607,Die Entwicklung der Tierbestände soll sichan der Fläche orientieren und wird in Einklang mit den Zielen des Klima-, Gewässer- undEmissionsschutzes (Ammoniak/Methan) gebracht.
608,Wir wollen die Emissionen aus Ammoniak undMethan unter Berücksichtigung des Tierwohls deutlich mindern.
609,Die Landwirte sollen auf dem Weg zurKlimaneutralität im Rahmen des Umbaus der Nutztierhaltung unterstützt werden.Wir streben an, Planungs- und Investitionssicherheit herzustellen.
610,Wir führen ein Prüf- undZulassungsverfahren für Stallsysteme und für serienmäßig hergestellte Betäubungsanlagen ein.
611,Wir 44verbessern die Rechtsvorschriften zum Schutz vor Bränden und technischen Störungen in Ställen, unterBerücksichtigung von angemessenen Übergangsfristen.
612,Wir schließen bestehende Lücken in derNutztierhaltungsverordnung und verbessern das Tierschutzgesetz (Qualzucht konkretisieren, nichtkurative Eingriffe deutlich reduzieren, Anbindehaltung spätestens in zehn Jahren beenden).Wir erarbeiten eine Tiergesundheitsstrategie und etablieren eine umfassende Datenbank (inkl.Verarbeitungsbetriebe tierischer Nebenprodukte).
613,Wir werden den wirkstoff- undanwendungsbezogenen Antibiotikaeinsatz in landwirtschaftlichen Betrieben erfassen und senken.Lebendtiertransporte in Drittstaaten werden künftig nur erlaubt, wenn sie auf Routen mitnachgewiesen tierschutzgerechten Versorgungseinrichtungen stattfinden.
614,Wir setzen uns auch auf EUEbene für bessere Regelungen für Tiertransporte und einen Ausbau des Datenbanksystems TRACESein.
615,Wir fördern dezentrale und mobile Schlachtstrukturen.
616,Sie schaffen die Rechtsgrundlage zurEinführung eines standardisierten kameragestützten Überwachungssystems in besonderstierschutzrelevanten Bereichen in Schlachthöfen ab einer relevanten Größe.
617,Wir schließen Rechts- undVollzugslücken im Bereich des Tierschutzes, um der Verantwortung aus der ausschließlich dem Staatzustehenden Eingriffskompetenz gerecht zu werden.
618,Wir überführen Teile des Tierschutzrechts in dasStrafrecht und erhöhen das maximale Strafmaß.
619,Wir legen eine Reduktionsstrategie zu Tierversuchenvor.
620,Wir verstärken die Forschung zu Alternativen, ihre Umsetzung in die Praxis und etablieren einressortübergreifendes Kompetenznetzwerk.Wir führen für den Onlinehandel mit Heimtieren eine verpflichtende Identitätsüberprüfung ein.
621,DieKennzeichnung und Registrierung von Hunden werden obligatorisch.
622,Wir aktualisieren die Leitlinienfür Tierbörsen und erarbeiten eine Positivliste für Wildtiere, die nach einer Übergangsfrist noch inZirkussen gehalten werden können.Die Bildungsarbeit Zoologischer Gärten werden wir unterstützen.
623,Tierheime werden wir durch eineVerbrauchsstiftung unterstützen.
624,Wir setzen uns für ein EU-weites Verbot der Haltung und Zucht vonPelztieren ein.
625,Der Bund nimmt in länderübergreifenden Krisen- und Seuchenfällen wie derAfrikanischen Schweinepest eine koordinierende und unterstützende Funktion wahr und beseitigtrechtliche Mängel.
626,Wir schaffen das Amt einer oder eines Tierschutzbeauftragten.
627,45Europäische AgrarpolitikWir sorgen unverzüglich dafür, dass die Begleitverordnungen zum nationalen Strategieplan derGemeinsamen Agrarpolitik (GAP) mit dem Ziel des Umwelt- und Klimaschutzes sowie derEinkommenssicherung angepasst werden.Die aktuelle Architektur wird spätestens zur Mitte der Legislaturperiode überprüft und im Sinne derZielerreichung angepasst.
628,Für die verlässliche Weiterentwicklung ab 2027 legt die Bundesregierung mitdieser Evaluierung ein Konzept vor, wie die Direktzahlungen durch die Honorierung von Klima- undUmweltleistungen angemessen ersetzt werden können.
629,Dies dient auch der Einkommenswirksamkeit.Gemeinschaftsaufgabe Verbesserung der Agrarstruktur und Küstenschutz (GAK)Orientiert an der Reform der GRW werden wir die Gemeinschaftsaufgabe neu an unseren Zielenausrichten und setzen uns für eine überjährige und flexible Finanzierung ein.
630,Neue Aufgaben wieNaturschutz und Klimaanpassung müssen durch zusätzliche Finanzmittel gesichert werden.Kooperationen zwischen Naturschutz und Landwirtschaft sollen für die landwirtschaftliche Förderungeine rechtliche Grundlage erhalten.ErnährungWir werden, insbesondere mit Blick auf Kinder, mit den Akteuren bis 2023 eine Ernährungsstrategiebeschließen, um eine gesunde Umgebung für Ernährung und Bewegung zu schaffen.Wir werden die Standards der Deutschen Gesellschaft für Ernährung aktualisieren, in derGemeinschaftsverpflegung als Standard etablieren, Vernetzungsstellen weiterbetreiben undModellregionenwettbewerb durchführen.
631,Unser Ziel ist, den Anteil regionaler und ökologischerErzeugnisse entsprechend unserer Ausbauziele zu erhöhen.
632,Wir werden gemeinsam mit allenBeteiligten die Lebensmittelverschwendung verbindlich branchenspezifisch reduzieren,haftungsrechtliche Fragen klären und steuerrechtliche Erleichterung für Spenden ermöglichen.
633,Wirstärken pflanzliche Alternativen und setzen uns für die Zulassung von Innovationen wie alternativeProteinquellen und Fleischersatzprodukten in der EU ein.
634,An Kinder gerichtete Werbung fürLebensmittel mit hohem Zucker-, Fett- und Salzgehalt darf es in Zukunft bei Sendungen und Formatenfür unter 14-Jährige nicht mehr geben.
635,Wir werden ein EU-weites Nutriscore wissenschaftlich undallgemeinverständlich weiterentwickeln.
636,Wir unterstützen die Entwicklung von Kriterien für einenökologischen Fußabdruck.
637,Wir werden den gesundheitlichen Verbraucherschutz stärken und zugesundheitsgefährdenden Stoffen wie endokrine Disruptoren, Mehrfachbelastungen,Kontaktmaterialen forschen.
638,Lebensmittelwarnung.de wird praktikabler weiterentwickelt.
639,Wir 46schaffen wissenschaftlich fundierte und auf Zielgruppenabgestimmte Reduktionsziele für Zucker, Fettund Salz.LandbauDas Artensterben, der Verlust der Biodiversität ist eine weitere ökologische Krise.
640,Wir wollen denEinsatz von Pflanzenschutzmitteln auf das notwendige Maß beschränken.
641,Mit folgenden Maßnahmenwollen wir den Einsatz ambitioniert reduzieren: Wir werden die gesamte Landwirtschaft in ihrer Vielfalt an den Zielen Umwelt- undRessourcenschutz ausrichten (Ökologischer Landbau).
642,Wir wollen eine Landwirtschaft im Einklangvon Natur und Umwelt weiterentwickeln.
643,Wir wollen 30 Prozent Ökolandbau bis zum Jahr 2030erreichen.
644,Hierfür wollen wir die Bundesmittel für das Bundesprogramm Ökolandbau erhöhen undentsprechend dem Ausbauziel Agrarforschungsgelder für Forschungsbelange des Ökolandbaus zurVerfügung stellen.
645,Wir erweitern die Zukunftsstrategie ökologischer Landbau um die gesamte BioWertschöpfungskette. Der integrierte Pflanzenschutz wird ergänzt, wir stärken seine Forschung und Förderung undentwickeln den Nationalen Aktionsplan weiter. Pflanzen sollen so geschützt werden, dass Nebenwirkungen für Umwelt, Gesundheit undBiodiversität vermieden werden.
646,Die Zulassung von Pflanzenschutzmitteln muss transparent undrechtssicher nach wissenschaftlichen Kriterien erfolgen, bestehende Lücken auf europäischerEbene werden geschlossen.
647,Gleichzeitig muss eine schnellere Entscheidung stattfinden. Zudem sorgen wir für eine Verbesserung der Verfügbarkeit von Pflanzenschutzmitteln,insbesondere für Anwendungen von geringfügigem Umfang bei vielfältig angebautenSonderkulturen, für den Vorratsschutz und für geeignete Resistenzstrategien. Wir setzen auch auf digitale Anwendungen und moderne Applikationstechnik zur zielgenauenAusbringung und Vermeidung von Abdrift. Wir stärken Alternativen zu chemisch-synthetischen Pflanzenschutzmitteln (Biologicals, low risks,Pflanzenstärkungsmittel, physikalisch, biologisch, Anbaumethoden, Robotik, Drohnen,Digitalisierung, Prognosemodelle etc.)
648,und verbessern die zugehörigen Verfahren. Analog zu bestehenden Reglungen zu Pestiziden in Naturschutzgebieten, bei den Landwirtinnenund Landwirten einen Erschwernisausgleich bekommen, wollen wir Regeln für dieTrinkwasserschutzgebiete finden. Wir nehmen Glyphosat bis Ende 2023 vom Markt. Ein digitales Herkunfts- und Identifikationssystem Nährstoff- und Pflanzenschutz, mit dem Ziel, dieReduktionsstrategie voranzubringen, soll eingeführt werden.
649,47 Die Züchtung von klimarobusten Pflanzensorten wollen wir unterstützen.
650,Dazu verbessern wir dieRahmenbedingungen auch für Populationssorten, fördern Modellprojekte wie Crowd-Breeding,Digitalisierung, stellen Transparenz über Züchtungsmethoden her und stärken die Risiko- undNachweisforschung.Digitalisierung in der LandwirtschaftWir werden die von der Landwirtschaft und Ernährung benötigten öffentlichen Daten einfacher und ingeeigneter Qualität und Aktualität den berechtigten Nutzern frei zur Verfügung stellen und dazu eineechte Plattform mit zentralem Zugang zu sämtlichen staatlichen Daten und Diensten einrichten,insbesondere auch für entsprechende Verwaltungsdienstleistungen.
651,Staatliche Daten allerVerwaltungsebenen sollen künftig in einheitlichen Formaten zur Verfügung gestellt werden.
652,DerAgrardatenraum in Gaia-X als Basis einer europäischen Dateninfrastruktur mit klarem Nutzungsrechtfür Landwirte an den betriebsspezifischen Daten, an deren Entstehung sie mitgewirkt haben, wird mitstandardisierten Schnittstellen weiterentwickelt.
653,Open-Source-Formate werden ausdrücklichunterstützt.BodenpolitikDie Debatte der EU-Kommission über die “Carbon Removal Certification Guidelines” begleiten wiraktiv.
654,Wir brauchen eine Aktualisierung des Bodenschutzgesetztes, ein Bodenmonitoringzentrum undwir müssen die EU bei einer Bodenrichtlinie unterstützen.
655,Wir verstärken Forschung und Förderung zuklimarobustem Pflanzenbau.
656,Sie startet hierfür ein Bundesprogramm „Zukunftsfähiger Ackerbau“.
657,DieEiweißpflanzenstrategie entwickeln wir weiter.Die BVVG-Flächen werden für Ausgleichs- und Ersatzmaßnahmen sowie Klima- und Artenschutzgenutzt.
658,Dabei werden landwirtschaftlich genutzte Flächen vorrangig an nachhaltig bzw.
659,ökologischwirtschaftende Betriebe verpachtet und nicht veräußert.FischereiWir setzen uns für den Erhalt der Fischerei an unseren Küsten ein.
660,Wir werden auf europäischer undinternationaler Ebene eine faire, wissenschaftsbasierte Ermittlung und Zuteilung der Fangquoteneinfordern.
661,Dazu werden wir eine „Zukunftskommission Fischerei“ initiieren, um Empfehlungen füreine nachhaltige Fischerei und Aquakultur, Binnen- und Hochseefischerei zu erarbeiten.
662,Wir wollen dieGrundschleppnetz-Fischerei beschränken und Fangtechniken artenspezifisch anpassen sowie einenaturschutzgerechte Regulierung von Stellnetzen.
663,Wir erkennen die Leistung der Anglerinnen undAngler für den Natur- und Artenschutz an.
664,48LebensmittelmarktWir unterstützen fairen Wettbewerb mit fairen Preisen im Lebensmittelmarkt.
665,Wir werden diekartellrechtliche Missbrauchsaufsicht und Fusionskontrolle im Bundeskartellamt stärken.
666,Wir gehengegen unfaire Handelspraktiken vor und prüfen, ob der Verkauf von Lebensmitteln unterProduktionskosten unterbunden werden kann.
667,Den Milchmarkt werden wir weiter beobachten unddie Bilanz der Lieferbeziehungen evaluieren.MobilitätWir wollen die 2020er Jahre zu einem Aufbruch in der Mobilitätspolitik nutzen und eine nachhaltige,effiziente, barrierefreie, intelligente, innovative und für alle bezahlbare Mobilität ermöglichen.
668,Für dienotwendigen Veränderungsprozesse werben wir um Akzeptanz und werden unsere Zieledialogorientiert umsetzen und die Maßnahmen regelmäßig überprüfen.
669,Die erforderlichenEntscheidungen zur Erreichung unserer Klimaschutzziele für 2030 und 2045 mit dem Ziel derDekarbonisierung des Mobilitätsbereiches werden wir treffen und die praktische Umsetzung deutlichbeschleunigen.
670,Mobilität ist für uns ein zentraler Baustein der Daseinsvorsorge, Voraussetzung fürgleichwertige Lebensverhältnisse und die Wettbewerbsfähigkeit des Wirtschafts- undLogistikstandorts Deutschland mit zukunftsfesten Arbeitsplätzen.
671,Dafür werden wir Infrastrukturausbauen und modernisieren sowie Rahmenbedingungen für vielfältige Mobilitätsangebote in Stadtund Land weiterentwickeln.InfrastrukturDie Investitionen in die Verkehrsinfrastruktur müssen weiter erhöht und langfristig abgesichertwerden.
672,Dabei wollen wir erheblich mehr in die Schiene als in die Straße investieren, um prioritärProjekte eines Deutschlandtaktes umzusetzen.
673,Bei den Bundesfernstraßen wollen wir einen stärkerenFokus auf Erhalt und Sanierung legen, mit besonderem Schwerpunkt auf Ingenieurbauwerke.
674,Dazuwerden wir den Anteil der Erhaltungsmittel bis 2025 bei wachsendem Etat schrittweise erhöhen.Wir streben einen neuen Infrastrukturkonsens bei den Bundesverkehrswegen an.
675,Dazu werden wirparallel zur laufenden Bedarfsplanüberprüfung einen Dialogprozess mit Verkehrs-, Umwelt-,Wirtschafts- und Verbraucherschutzverbänden starten mit dem Ziel einer Verständigung über diePrioritäten bei der Umsetzung des geltenden Bundesverkehrswegeplan.
676,Bis zurBedarfsplanüberprüfung gibt es eine gemeinsame Abstimmung über die laufenden Projekte.
677,49Wir werden auf Basis neuer Kriterien einen neuen Bundesverkehrswege- und -mobilitätsplan 2040 aufden Weg bringen.
678,Wir wollen das Nebeneinander von Autobahn GmbH und Deutsche EinheitFernstraßenplanungs- und -bau Gesellschaft (DEGES) aufheben.
679,Zwischen Bund und Autobahn GmbHwollen wir eine überjährige Finanzierungsvereinbarung abschließen.Wir werden 2023 eine CO2-Differenzierung der Lkw-Maut vornehmen, den gewerblichenGüterkraftverkehr ab 3,5 Tonnen einbeziehen und einen CO2-Zuschlag einführen, unter der Bedingung,eine Doppelbelastung durch den CO2-Preis auszuschließen.
680,Wir werden die Mehreinnahmen fürMobilität einsetzen.Wir wollen Lärmbelastungen durch den Verkehr reduzieren, setzen uns für eine Reduzierung vonmutwilligem Lärm ein und sorgen für mehr aktiven und passiven Lärmschutz.
681,Um zu angemessenenLärmschutzmaßnahmen zu kommen, werden wir die gesamte Lärmsituation berücksichtigen.
682,DieLärmsanierungsprogramme für Bundesfernstraßen und Schienenwege werden wir besser finanzieren.Innovative Technik zur Lärmvermeidung, so für neue Güterwagen, werden wir bis zur Markteinführungunterstützen.BahnverkehrWir werden den Masterplan Schienenverkehr weiterentwickeln und zügiger umsetzen, denSchienengüterverkehr bis 2030 auf 25 Prozent steigern und die Verkehrsleistung im Personenverkehrverdoppeln.
683,Den Zielfahrplan eines Deutschlandtaktes und die Infrastrukturkapazität werden wir aufdiese Ziele ausrichten.
684,Sofern haushalteerisch machbar, soll die Nutzung der Schiene günstigerwerden, um die Wettbewerbsfähigkeit der Bahnen zu stärken.Wir werden mehr Oberzentren an den Fernverkehr anbinden.
685,Wir werden die Umsetzung einesDeutschlandtaktes infrastrukturell, finanziell, organisatorisch, eisenbahnrechtlich undeuroparechtskonform absichern.Grenzüberscheitenden Verkehr wollen wir stärken und mit der EU sowie ihren MitgliedstaatenNachtzugangebote aufbauen.
686,Bis 2030 wollen wir 75 Prozent des Schienennetzes elektrifizieren undinnovative Antriebstechnologien unterstützen.
687,Die Digitalisierung von Fahrzeugen und Streckenwerden wir prioritär vorantreiben.
688,Wir werden ein Programm „Schnelle Kapazitätserweiterung“auflegen, Barrierefreiheit und Lärmschutz verbessern, Bahnhofsprogramme bündeln und stärken, dasStreckennetz erweitern, Strecken reaktivieren und Stilllegungen vermeiden und eine 50Beschleunigungskommission Schiene einsetzen.
689,Die Einführung der Digitalen Automatischen Kupplungwollen wir beschleunigen, den Einzelwagenverkehr stärken und Investitionsanreize für Gleisanschlüssesetzen.
690,Bei neuen Gewerbe- und Industriegebieten soll die Schienenanbindung verpflichtend geprüftwerden.
691,KV-Terminals wollen wir weiter fördern, die Kranbarkeit von Standard-Sattelaufliegernvorantreiben und den Zu- und Ablauf bis max.
692,50 Kilometer von der Lkw-Maut freistellen.Wir werden die Deutsche Bahn AG als integrierten Konzern inklusive des konzerninternenArbeitsmarktes im öffentlichen Eigentum erhalten.
693,Die internen Strukturen werden wir effizienter undtransparenter gestalten.
694,Die Infrastruktureinheiten (DB Netz, DB Station und Service) der DeutschenBahn AG werden innerhalb des Konzerns zu einer neuen, gemeinwohlorientierten Infrastrukturspartezusammengelegt.
695,Diese steht zu 100 Prozent im Eigentum der Deutschen Bahn als Gesamtkonzern.Gewinne aus dem Betrieb der Infrastruktur verbleiben zukünftig in der neuen Infrastruktureinheit.
696,DieEisenbahnverkehrsunternehmen werden markt- und gewinnorientiert im Wettbewerb weitergeführt.Wir wollen die Investitionsmittel für die DB Infrastruktur erhöhen.Öffentlicher Verkehr und neue MobilitätsangeboteWir wollen Länder und Kommunen in die Lage versetzen, Attraktivität und Kapazitäten des ÖPNV zuverbessern.
697,Ziel ist, die Fahrgastzahlen des öffentlichen Verkehrs deutlich zu steigern.
698,2022 werdenwir die pandemiebedingten Einnahmeausfälle wie bisher ausgleichen.
699,Wir wollen einen Ausbau- undModernisierungspakt, bei dem sich Bund, Länder und Kommunen unter anderem über dieFinanzierung bis 2030 einschließlich der Eigenanteile der Länder und Kommunen und die Aufteilungder Bundesmittel verständigen sowie Tarifstrukturen diskutieren.
700,Regionalisierungsmittel werden ab2022 erhöht.
701,Gemeinsam werden wir Qualitätskriterien und Standards für Angebote undErreichbarkeit für urbane und ländliche Räume definieren.Für eine nahtlose Mobilität verpflichten wir Verkehrsunternehmen und Mobilitätsanbieter, ihreEchtzeitdaten unter fairen Bedingungen bereitzustellen.
702,Anbieterübergreifende digitale Buchung undBezahlung wollen wir ermöglichen.
703,Den Datenraum Mobilität entwickeln wir weiter.Intermodale Verknüpfungen werden wir stärken und barrierefreie Mobilitätsstationen fördern.Digitale Mobilitätsdienste, innovative Mobilitätslösungen und Carsharing werden wir unterstützen undin eine langfristige Strategie für autonomes und vernetztes Fahren öffentlicher Verkehre einbeziehen.
704,51Damit alle neuen Busse einschließlich der Infrastrukturen möglichst zeitnah klimaneutral fahren, wirdder Bund die bestehende Förderung verlängern und mittelstandsfreundlicher ausgestalten.Wir setzen uns für faire Arbeitsbedingungen im ÖPNV ein.
705,Zu diesem Zweck stärken wir die Tariftreueund schaffen die gesetzliche Grundlage dafür, Tarifverträge zur Bedingung bei Ausschreibungen zumachen.
706,Mittelständische Interessen sind bei der Vergabe zu berücksichtigen.
707,Am Vorrangeigenwirtschaftlicher Verkehre halten wir fest.Mobilitätsforschung werden wir interdisziplinär aufwerten, das Zentrum Zukunft der Mobilität neuaufstellen und erweitern, sowie das Zentrum für Schienenverkehrsforschung stärken.GüterverkehrWir unterstützen regionale Güterverkehrskonzepte, fördern emissionsfreie Stadtlogistik wieLadezonen und Logistik-Hubs.
708,Die Genehmigungspraxis von Schwerlast- und Großraumtransportenwollen wir erleichtern.
709,Die Kontrollbehörden werden wir stärken und bessere Sozialstandards undArbeitsbedingungen durchsetzen.
710,Sichere Lkw-Stellflächen an und um Autobahnen werden wirausbauen und telematisch optimieren.
711,Wir werden dem Fachkräftemangel entgegenwirken,Qualifizierung modernisieren und Bürokratie abbauen.AutoverkehrWir werden den Transformationsprozess der deutschen Automobilindustrie vor dem Hintergrund vonDigitalisierung und Dekarbonisierung unterstützen.
