ID,"Joke"
1,SPD.DE / GRUENE.DE / FDP.DEBÜNDNIS FÜRFREIHEIT, GERECHTIGKEITUND NACHHALTIGKEITKOALITIONSVERTRAG ZWISCHENSPD, BÜNDNIS 90/DIE GRÜNEN UND FDPMEHRFORTSCHRITTWAGENMehr Fortschritt wagenBündnis für Freiheit, Gerechtigkeit und NachhaltigkeitKoalitionsvertrag 2021 – 2025 zwischen der Sozialdemokratischen Partei Deutschlands (SPD),BÜNDNIS 90 / DIE GRÜNEN und den Freien Demokraten (FDP) 2 3InhaltsverzeichnisI.
2,Präambel............................................................................................................................................... 4II.
3,Moderner Staat, digitaler Aufbruch und Innovationen ....................................................................... 8Moderner Staat und Demokratie ........................................................................................................ 8Digitale Innovationen und digitale Infrastruktur ............................................................................... 15Innovation, Wissenschaft, Hochschule und Forschung ..................................................................... 19III.
4,Klimaschutz in einer sozial-ökologischen Marktwirtschaft .............................................................. 24Wirtschaft .......................................................................................................................................... 25Umwelt- und Naturschutz ................................................................................................................. 36Landwirtschaft und Ernährung .......................................................................................................... 43Mobilität ............................................................................................................................................ 48Klima, Energie, Transformation ......................................................................................................... 54IV.
5,Respekt, Chancen und soziale Sicherheit in der modernen Arbeitswelt ......................................... 65Arbeit ................................................................................................................................................. 66Sozialstaat, Altersvorsorge, Grundsicherung .................................................................................... 72Pflege und Gesundheit ...................................................................................................................... 80Bauen und Wohnen ........................................................................................................................... 88V.
6,Chancen für Kinder, starke Familien und beste Bildung ein Leben lang ........................................... 93Bildung und Chancen für alle ............................................................................................................ 94Kinder, Jugend, Familien und Senioren ............................................................................................. 98VI.
7,Freiheit und Sicherheit, Gleichstellung und Vielfalt in der modernen Demokratie ....................... 103Innere Sicherheit, Bürgerrechte, Justiz, Verbraucherschutz, Sport ................................................ 103Gleichstellung .................................................................................................................................. 114Vielfalt ............................................................................................................................................. 116Kultur- und Medienpolitik ............................................................................................................... 121Gute Lebensverhältnisse in Stadt und Land .................................................................................... 127VII.
8,Deutschlands Verantwortung für Europa und die Welt ............................................................... 130Europa ............................................................................................................................................. 131Integration, Migration, Flucht ......................................................................................................... 137Außen, Sicherheit, Verteidigung, Entwicklung, Menschenrechte ................................................... 143VIII.
9,Zukunftsinvestitionen und nachhaltige Finanzen ........................................................................ 158IX.
10,Arbeitsweise der Regierung und Fraktionen .................................................................................. 173 I. PräambelDas Ergebnis der Bundestagswahl verstehen unsere drei Parteien als Auftrag, eine gemeinsameRegierungskoalition zu bilden.Wir haben unterschiedliche Traditionen und Perspektiven, doch uns einen die Bereitschaft,gemeinsam Verantwortung für die Zukunft Deutschlands zu übernehmen, das Ziel, die notwendigeModernisierung voranzutreiben, das Bewusstsein, dass dieser Fortschritt auch mit einemSicherheitsversprechen einhergehen muss und die Zuversicht, dass dies gemeinsam gelingen kann.
11,Wirverpflichten uns, dem Wohle aller Bürgerinnen und Bürger zu dienen.Was das Land herausfordertWir übernehmen Verantwortung in einer Zeit, in der die Corona-Pandemie das Land weiter starkbelastet.
12,Sie bedeutet für viele großes Leid, geht einher mit existenziellen Sorgen und verlangt allenerhebliche Einschränkungen ab.
13,Die Pandemie zu besiegen, ist in diesen Tagen unsere vordringlichsteAufgabe, der wir uns mit voller Kraft widmen.
14,Die notwendigen Schutzmaßnahmen umzusetzen undeinen umfassenden Impfschutz voranzutreiben, ist eine gesamtstaatliche und gesamtgesellschaftlicheAufgabe.Die Welt ist am Beginn eines Jahrzehnts im Umbruch, deshalb können wir nicht im Stillstand verharren.Die Klimakrise gefährdet unsere Lebensgrundlagen und bedroht Freiheit, Wohlstand und Sicherheit.Deutschland und Europa müssen angesichts eines verschärften globalen Wettbewerbs ihreökonomische Stärke neu begründen.
15,Im internationalen Systemwettstreit gilt es, unsere Werteentschlossen mit demokratischen Partnern zu verteidigen.
16,Zugleich verändert die Digitalisierung dieArt und Weise wie wir wirtschaften, arbeiten und miteinander kommunizieren.
17,Unsere Gesellschaftwird älter und diverser.
18,Auch gilt es, gesellschaftliche Spannungen in Zeiten des schnellen Wandels zureduzieren und das Vertrauen in unsere Demokratie zu stärken.Diese Herausforderungen sind immens, miteinander verwoben und in ihrer Gleichzeitigkeitanspruchsvoll.
19,Sie werden das Land und die Gesellschaft über lange Zeit prägen.
20,Doch wenn wir dieseUmbrüche gestalten, liegen auch große Chancen darin.
21,Aufgabe dieser Koalition ist es, die dafürnötigen Neuerungen politisch anzuschieben und Orientierung zu geben.
22,Damit wollen wir eine neueDynamik auslösen, die in die gesamte Gesellschaft hineinwirkt.
23,5Was wir voranbringen wollenDeutschland wird nur auf der Höhe der Zeit agieren können, wenn wir den Staat selbst modernisieren.Wir wollen staatliches Handeln schneller und effektiver machen und besser auf künftige Krisenvorbereiten.
24,Wir bringen eine umfassende Digitalisierung der Verwaltung voran.
25,Es geht darum, dasLeben für die Bürgerinnen und Bürger leichter zu machen.
26,Wir werden die öffentliche Infrastruktur,öffentliche Räume und Netze modernisieren und dafür Planung, Genehmigung und Umsetzungdeutlich beschleunigen.
27,Auch die Wirtschaft soll in der Verwaltung einen Verbündeten haben.Mehr als 30 Jahre nach der Deutsche Einheit bleibt es unsere Aufgabe, die innere Einheit sozial undwirtschaftlich zu vollenden.
28,Die Lebensverhältnisse in unseren Regionen, in Städten und demländlichen Raum sind nicht gleich, aber sie sollten gleichwertig sein.
29,Zu guten Lebensbedingungengehören bezahlbares Wohnen, schnelles Internet, eine erreichbare Gesundheitsversorgung undalltagstaugliche, nachhaltige Mobilitätsangebote.Die Klimaschutzziele von Paris zu erreichen, hat für uns oberste Priorität.
30,Klimaschutz sichert Freiheit,Gerechtigkeit und nachhaltigen Wohlstand.
31,Es gilt, die soziale Marktwirtschaft als eine sozialökologische Marktwirtschaft neu zu begründen.
32,Wir schaffen ein Regelwerk, das den Weg frei machtfür Innovationen und Maßnahmen, um Deutschland auf den 1,5-Grad-Pfad zu bringen.
33,Wir bringenneues Tempo in die Energiewende, indem wir Hürden für den Ausbau der Erneuerbaren Energien ausdem Weg räumen.
34,Schritt für Schritt beenden wir das fossile Zeitalter, auch, indem wir denKohleausstieg idealerweise auf 2030 vorziehen und die Technologie des Verbrennungsmotors hinteruns lassen.Unseren Wohlstand in der Globalisierung zu sichern ist nur möglich, wenn wir wirtschaftlich undtechnologisch weiter in der Spitzenliga spielen und die Innovationskräfte unserer Wirtschaft entfalten.Grundlage dafür sind faire Wettbewerbsbedingungen; dazu gehört auch eine faire Besteuerung –national und international – sowie die konsequente Bekämpfung von Steuerhinterziehung.In die Modernisierung des Landes muss umfassend investiert werden – privat wie öffentlich.
35,Dieöffentlichen Investitionen insbesondere in Klimaschutz, Digitalisierung, Bildung und Forschung werdenwir im Rahmen der bestehenden Schuldenregel des Grundgesetzes gewährleisten, Anreize für privateInvestitionen setzen und Raum für unternehmerisches Wagnis schaffen, um so Wachstum zugenerieren.
36,6Die nötigen Fachkräfte wollen wir durch bessere Bildungschancen, gezielte Weiterbildung, dieErhöhung der Erwerbsbeteiligung sowie durch eine Modernisierung des Einwanderungsrechtsgewinnen.Jede und jeder soll das eigene Leben frei und selbstbestimmt gestalten können.
37,Aber die Chancen sindnicht für alle gleich verteilt.
38,Deshalb müssen die Grundlagen für soziale Aufstiegschancen schon in Kitaund Schule gelegt werden.
39,Wir konzentrieren uns auf die Bereiche, in denen Unterstützung besondersgebraucht wird und wollen enger mit den Ländern zusammenarbeiten.
40,Wir wollen Familien stärkenund mehr Kinder aus der Armut holen.
41,Dafür führen wir eine Kindergrundsicherung ein.
42,Kinder habeneigene Rechte, die wir im Grundgesetz verankern werden.Berufsbiographien sind häufig von Brüchen geprägt, gerade in Zeiten des Wandels.
43,Wir wollenSicherheit auch im Übergang geben und dazu ermutigen, Neues zu wagen.
44,Leistung muss anerkanntund Arbeit gerecht bezahlt werden.
45,Darum werden wir den Mindestlohn auf 12 Euro anheben und unsfür Entgeltgleichheit von Frauen und Männern einsetzen.
46,Wir halten das Rentenniveau stabil,erweitern die gesetzliche Rentenversicherung um eine teilweise Kapitaldeckung und werden dasSystem der privaten Altersvorsorge grundlegend reformieren.
47,Wir lösen die Grundsicherung durch einneues Bürgergeld ab, damit die Würde des Einzelnen geachtet und gesellschaftliche Teilhabe bessergefördert wird.Die Kraft unserer Republik liegt in der freiheitlichen Vielfalt und im demokratischen und sozialenZusammenhalt.
48,Sicherheit und Freiheit bedingen einander.
49,Die Sicherheitsbehörden und ihreBeschäftigten verdienen Respekt und Unterstützung.
50,Wir wollen ihre Strukturen und Zusammenarbeiteffizienter machen.
51,Wir verteidigen unseren Rechtsstaat und sichern den Schutz unserer Bürgerinnenund Bürger.Unsere Maxime ist eine freie Gesellschaft, in der die Gleichstellung von Frauen und Männernverwirklicht ist sowie unterschiedliche Lebensentwürfe und Biografien ihren Platz haben.
52,Unsverbindet das Verständnis von Deutschland als vielfältige Einwanderungsgesellschaft.
53,Um dergesellschaftlichen Wirklichkeit Rechnung zu tragen, ermöglichen wir gleichberechtigte Teilhabe undmodernisieren die Rechtsnormen – vom Familienrecht bis hin zum Staatsbürgerschaftsrecht.
54,JeglicherDiskriminierung wirken wir entgegen.
55,7Eine starke Demokratie lebt von den Menschen, die sie tragen.
56,Sie braucht eine vielfältige Kultur undfreie Medien.
57,Ehrenamt und demokratisches Engagement stärken den gesellschaftlichenZusammenhalt.
58,Sie verlässlich zu fördern, ist unsere Aufgabe.Die großen Herausforderungen unserer Zeit lassen sich nur in internationaler Kooperation undgemeinsam in einer starken Europäischen Union bewältigen.
59,Wir stehen zur globalen VerantwortungDeutschlands als einer großen Industrienation in der Welt.
60,Der Einsatz für Frieden, Freiheit,Menschenrechte, Demokratie, Rechtsstaatlichkeit und Nachhaltigkeit ist für uns unverzichtbarer Teileiner erfolgreichen und glaubwürdigen Außenpolitik.
61,Wir bekennen uns zu unserer humanitärenSchutzverantwortung und wollen die Verfahren zu Flucht und Migration ordnen.Wir handeln dabei im europäischen Selbstverständnis und in Abstimmung mit unseren internationalenPartnern.
62,Die strategische Souveränität der Europäischen Union wollen wir erhöhen, indem wir unsereAußen-, Sicherheits-, Entwicklungs- und Handelspolitik wertebasiert und als Basis gemeinsamereuropäischer Interessen ausrichten.Wie wir arbeiten wollenDeutschland ist vielfältig und die Gesellschaft ist freier und reicher an Perspektiven, aber auchkomplexer und widersprüchlicher geworden.
63,Gemeinsinn, Solidarität und Zusammenhalt sind neu zubestimmen.
64,Das gelingt nicht, indem man über Unterschiede hinweggeht, sondern indem dieunterschiedlichen Stimmen in unserem Land gleichberechtigt Gehör finden.In diesem Sinne spiegelt eine Koalition aus unseren drei so unterschiedlichen Parteien auch einen Teilder komplexen gesellschaftlichen Wirklichkeit wider.
65,Wenn wir es schaffen, gemeinsam die Dingevoranzutreiben, kann das ein ermutigendes Signal in die Gesellschaft hinein sein: dass Zusammenhaltund Fortschritt auch bei unterschiedlichen Sichtweisen gelingen können.Wir wollen eine Kultur des Respekts befördern – Respekt für andere Meinungen, für Gegenargumenteund Streit, für andere Lebenswelten und Einstellungen.
66,Der vorliegende Koalitionsvertrag zeigt, dasswir tragfähige gemeinsame Lösungen gefunden haben.
67,Er bildet die Arbeitsgrundlage für unsereKoalition.
68,8II.
69,Moderner Staat, digitaler Aufbruch und InnovationenDeutschland muss handlungs- und leistungsfähig sein, insbesondere in Krisenzeiten.
70,Der Staat mussvorausschauend für seine Bürgerinnen und Bürger arbeiten.
71,Dazu wollen wir ihn modernisieren, sodass er Chancen ermöglicht und Sicherheit gibt.
72,Ein Staat, der die Kooperation mit Wirtschaft undZivilgesellschaft sucht, mehr Transparenz und Teilhabe in seinen Entscheidungen bietet und mit einerunkomplizierten, schnellen und digitalen Verwaltung das Leben der Menschen einfacher macht.Für die vor uns liegenden Aufgaben braucht es Tempo beim Infrastrukturausbau.
73,Die Verfahren,Entscheidungen und Umsetzungen müssen deutlich schneller werden.
74,Wir werden deshalb Planungsund Genehmigungsverfahren modernisieren, entbürokratisieren und digitalisieren sowie diePersonalkapazitäten verbessern.
75,Indem wir Bürgerinnen und Bürger früher beteiligen, machen wir diePlanungen schneller und effektiver.Wir wollen das Potenzial der Digitalisierung in Staat und Gesellschaft besser nutzen.
76,Unser Ziel ist dieflächendeckende Versorgung mit Glasfaser und dem neuesten Mobilfunkstandard.
77,Wir werden digitaleSchlüsseltechnologien fördern und die Bedingungen für Start-ups am Technologiestandort verbessern.Wir haben Lust auf Neues und werden technologische, digitale, soziale und nachhaltigeInnovationskraft befördern.
78,Durch bessere Rahmenbedingungen für Hochschule, Wissenschaft undForschung wollen wir den Wissenschaftsstandort kreativer und wettbewerbsfähiger machen.Wissenschafts- und Forschungsfreiheit sind der Schlüssel für kreative Ideen, die dazu beitragen, diegroßen Herausforderungen unserer Zeit zu bewältigen.Moderner Staat und DemokratieWir wollen einen grundlegenden Wandel hin zu einem ermöglichenden, lernenden und digitalen Staat,der vorausschauend für die Bürgerinnen und Bürger arbeitet.
79,Es geht darum, das Leben einfacher zumachen.
80,Staatliches Handeln soll schneller und effektiver werden und wirtschaftliche wiegesellschaftliche Innovationsprozesse befördern und einbinden.
81,Wir wollen eine neue Kultur derZusammenarbeit etablieren, die auch aus der Kraft der Zivilgesellschaft heraus gespeist wird.
82,9VerwaltungsmodernisierungDie Verwaltung soll agiler und digitaler werden.
83,Sie muss auf interdisziplinäre und kreativeProblemlösungen setzen.
84,Wir werden sie konsequent aus der Nutzungsperspektive heraus denken.Wir wollen das Silodenken überwinden und werden feste ressort- und behördenübergreifende agileProjektteams und Innovationseinheiten mit konkreten Kompetenzen ausstatten.
85,Wir werdenproaktives Verwaltungshandeln durch antragslose und automatisierte Verfahren gesetzlichverankern.Von der Leitung der Ministerien und den Führungskräften im Öffentlichen Dienst erwarten wir, dasssie eine moderne Führungs- und Verwaltungskultur vorantreiben und für digitale Lösungen sorgen.Eigeninitiative und Mut der Beschäftigten müssen wertgeschätzt und belohnt werden.Die Modernisierung des Staates gelingt nur mit einem starken Öffentlichen Dienst.
86,Diesen werden wirattraktiver gestalten.
87,Der Staat muss bei Vielfalt, Gleichstellung und flexiblen sowie digitalenArbeitsbedingungen Vorbild sein.
88,Wir fördern und vereinfachen den Personalaustausch und dieRotation zwischen verschiedenen Behörden, zwischen Bund und Ländern sowie zwischen Verwaltungund Privatwirtschaft.
89,Die Einstellungsvoraussetzungen flexibilisieren wir in Richtung praktischerBerufserfahrungen und stärken das Instrument des Altersgeldes.
90,Die Digitalisierung wird zu einemallgemeinen und behördenübergreifenden Kernbestandteil der Ausbildung.
91,Um die Integrität desÖffentlichen Dienstes sicherzustellen, werden wir dafür sorgen, dass Verfassungsfeinde schneller alsbisher aus dem Dienst entfernt werden können.Lebendige DemokratieDemokratie lebt vom Vertrauen in alle staatlichen Institutionen und Verfassungsorgane.
92,Wir werdendaher das Parlament als Ort der Debatte und der Gesetzgebung stärken.Wir wollen die Qualität der Gesetzgebung verbessern.
93,Dazu werden wir neue Vorhaben frühzeitig undressortübergreifend, auch in neuen Formaten, diskutieren.
94,Wir werden dabei die Praxis und betroffeneKreise aus der Gesellschaft und Vertreterinnen und Vertreter des Parlaments besser einbinden sowiedie Erfahrungen und Erfordernisse von Ländern und Kommunen bei der konkretenGesetzesausführung berücksichtigen.
95,Im Vorfeld des Gesetzgebungsverfahrens soll die Möglichkeit derdigitalen Ausführung geprüft werden (Digitalcheck).
96,Wir werden ein Zentrum für Legistik errichten.
97,10Wir werden ein digitales Gesetzgebungsportal schaffen, über das einsehbar ist, in welcher Phase sichVorhaben befinden.
98,Dort werden wir öffentliche Kommentierungsmöglichkeiten erproben.Gesetzentwürfen der Bundesregierung wird künftig eine Synopse beigefügt, die die aktuelle Rechtslageden geplanten Änderungen gegenüberstellt.
99,Wir wollen Gesetze verständlicher machen.
100,DieBarrierefreiheit in den Angeboten von Bundestag und Bundesregierung werden wir ausbauen.Wir wollen die Entscheidungsfindung verbessern, indem wir neue Formen des Bürgerdialogs wie etwaBürgerräte nutzen, ohne das Prinzip der Repräsentation aufzugeben.
101,Wir werden Bürgerräte zukonkreten Fragestellungen durch den Bundestag einsetzen und organisieren.
102,Dabei werden wir aufgleichberechtigte Teilhabe achten.
103,Eine Befassung des Bundestages mit den Ergebnissen wirdsichergestellt.
104,Das Petitionsverfahren werden wir insgesamt stärken und digitalisieren und dieMöglichkeit schaffen öffentliche Petitionen in Ausschüssen und im Plenum zu beraten.TransparenzWir wollen durch mehr Transparenz unsere Demokratie stärken.
105,Uns leiten die Prinzipien offenenRegierungshandelns – Transparenz, Partizipation und Zusammenarbeit.
106,Wir werden dasLobbyregistergesetz nachschärfen, Kontakte zu Ministerien ab Referentenebene einbeziehen und denKreis der eintragungspflichtigen Interessenvertretungen grundrechtsschonend und differenzierterweitern.
107,Für Gesetzentwürfe der Bundesregierung und aus dem Bundestag werden wir EinflüsseDritter im Rahmen der Vorbereitung von Gesetzesvorhaben und bei der Erstellung vonGesetzentwürfen umfassend offenlegen (sog.
108,Fußabdruck).
109,Die Regelung findet ihre Grenzen in derFreiheit des Mandats.
110,Wir wollen die Nationalen Aktionspläne im Rahmen der Open-GovernmentPartnership (OGP) Deutschlands umsetzen und weiterentwickeln.Wir werden den Straftatbestand der Abgeordnetenbestechung und -bestechlichkeit wirksamerausgestalten.Parteiensponsoring werden wir ab einer Bagatellgrenze veröffentlichungspflichtig machen.
111,Die Pflichtzur sofortigen Veröffentlichung von Zuwendungen an Parteien wird auf 35.000 Euro herabgesetzt.Spenden und Mitgliedsbeiträge, die in der Summe 7.500 Euro pro Jahr überschreiten, werden imRechenschaftsbericht veröffentlichungspflichtig.
112,Wir schützen die Integrität des politischenWettbewerbs vor einer Beeinträchtigung durch verdeckte Wahlkampffinanzierung mittels sogenannter Parallelaktionen.
113,Die Bundestagsverwaltung wird für ihre Aufsichts- und Kontrollfunktion inden Bereichen Transparenz und Parteienfinanzierung personell und finanziell besser ausgestattet.
114,Wirwollen das Parteiengesetz auf den Stand der Zeit bringen und dabei insbesondere den Parteien mehr 11digitale Beschlussfassungen und im Rahmen der verfassungsrechtlichen Grenzen digitale Wahlenermöglichen.
115,Dies soll unter Einbeziehung möglichst aller demokratischen Fraktionen geschehen.Politische Bildung und Demokratieförderung sind mehr gefordert denn je, denn auch in Deutschlandsteht die pluralistische, freiheitliche Demokratie unter Druck.
116,Akteurinnen und Akteure dernachhaltigen Demokratieförderung, die auf Basis von Respekt, Toleranz, Würde und Menschenrechtenarbeiten, werden auch in Zukunft mit öffentlichen Mitteln gefördert.
117,Die Arbeit und Finanzierung derpolitischen Stiftungen wollen wir rechtlich besser absichern.
118,Dies soll aus der Mitte des Parlamentsgeschehen unter Einbeziehung möglichst aller demokratischen Fraktionen.
119,DieInformationsfreiheitsgesetze werden wir zu einem Bundestransparenzgesetz weiterentwickeln.FöderalismusDer Föderalismus ist eine Grundsäule der Bundesrepublik.
120,Um die Leistungsfähigkeit zu erhöhen,braucht es Klarheit bei den Aufgaben und der Finanzierung.
121,Wir streben eine engere, zielgenauere undverbindliche Kooperation zwischen Bund, Ländern und Kommunen an.
122,Dazu werden wir gemeinsammit Kommunen und Ländern einen Föderalismusdialog zur transparenteren und effizienterenVerteilung der Aufgaben, insbesondere zu den Themen Katastrophen- und Bevölkerungsschutz,Bildung und Innere Sicherheit sowie zur Nutzung der Möglichkeiten der Digitalisierung, führen.Wir stehen zum Bonn-Berlin-Gesetz.
123,Hierzu wird der Bund mit der Region Bonn sowie den LändernNordrhein-Westfalen und Rheinland-Pfalz eine vertragliche Zusatzvereinbarung abschließen.WahlrechtWir werden innerhalb des ersten Jahres das Wahlrecht überarbeiten, um nachhaltig das Anwachsendes Bundestages zu verhindern.
124,Der Bundestag muss effektiv in Richtung der gesetzlichen Regelgrößeverkleinert werden.
125,Eine Verzerrung der Sitzverteilung durch unausgeglichene Überhangmandatelehnen wir ab.Wir werden die „Kommission zur Reform des Bundeswahlrechts und zur Modernisierung derParlamentsarbeit“ erneut einsetzen.
126,Die Kommission wird sich mit dem Ziel einer paritätischenRepräsentanz von Frauen und Männern im Parlament befassen und die rechtlichenRahmenbedingungen erörtern.
127,Die Kommission wird zudem Vorschläge zur Bündelung vonWahlterminen, zur Verlängerung der Legislaturperiode auf fünf Jahre sowie zur Begrenzung derAmtszeit des Bundeskanzlers / der Bundeskanzlerin prüfen.
128,12Wir werden das aktive Wahlalter für die Wahlen zum Europäischen Parlament auf 16 Jahre senken.Wir wollen das Grundgesetz ändern, um das aktive Wahlalter für die Wahl zum Deutschen Bundestagauf 16 Jahre zu senken.
129,Wir wollen die Ausübung des Wahlrechts für im Ausland lebende Deutscheerleichtern.Planungs- und GenehmigungsbeschleunigungUm Deutschland zügig zu modernisieren, sind schnelle Verwaltungs-, Planungs- undGenehmigungsverfahren zentrale Voraussetzung.
130,Daher sollen im ersten Jahr der Regierung allenotwendigen Entscheidungen getroffen und durchgesetzt werden, um private wie staatlicheInvestitionen schnell, effizient und zielsicher umsetzen zu können.
131,Unser Ziel ist es, dieVerfahrensdauer mindestens zu halbieren.
132,Dafür müssen Staat und Gesellschaft sowie Bund, Länderund Kommunen an einem Strang ziehen.
133,Wir wollen eine auf Rechtssicherheit und gegenseitigemVertrauen fußende Planungskultur in Deutschland verwirklichen.
134,Alle staatlichen Stellen sollenVerwaltungsverfahren so vereinfachen und verbessern, dass gerichtliche Auseinandersetzungenmöglichst vermieden werden.
135,Wir werden mehr Möglichkeiten im Rahmen des Verfassungs- undUnionsrechts ausnutzen.Wir werden die personellen und technischen Kapazitäten bei Behörden und Gerichten erhöhen.
136,Füreine Personal- und Weiterbildungsoffensive sowie die Digitalisierung auf allen Ebenen streben wireinen verlässlichen und nachhaltigen Pakt für Planungs-, Genehmigungs- undUmsetzungsbeschleunigung mit den Ländern an.
137,Die Inhouse-Beratungskapazitäten der öffentlichenHand werden zu Beschleunigungsagenturen ausgebaut, auf die auch Länder und Kommunen einfachzugreifen können.
138,Die Einsatzmöglichkeiten für private Projektmanagerinnen und Projektmanagerwerden ausgedehnt.
139,Für Angelegenheiten des Planungsrechts schaffen wir die Voraussetzungen fürzusätzliche Senate am Bundesverwaltungsgericht.
