ID,"Joke"
1778,Die EZB kann ihr Mandat, das vor allem dem Ziel derPreisstabilität verpflichtet ist, dann am besten ausüben, wenn die Haushaltspolitik in der EU und in denMitgliedsstaaten ihrer Verantwortung nachkommt.InvestitionenEine europäische digitale Infrastruktur, ein gemeinsames Eisenbahnnetz, eine Energieinfrastruktur fürerneuerbaren Strom und Wasserstoff sowie Forschung und Entwicklung auf dem Niveau derWeltspitze sind Voraussetzungen für die europäische Handlungsfähigkeit und Wettbewerbsfähigkeit 134im 21.
1779,Jahrhundert.
1780,Dafür werden wir die Initiative ergreifen und mit unseren europäischen Partnerneine Investitionsoffensive anstoßen, die sich auf transnationale Projekte mit einem Mehrwert für dieEU als Ganzes fokussiert sowie dem Lückenschluss von Netzen eine besondere Bedeutung zumisst.Dabei soll sowohl öffentliches als auch privates Kapital eine Rolle spielen.Soziales EuropaWir wollen die Menschen darin unterstützen, die immensen Herausforderungen der bevorstehendenTransformation und den Wandel selbstbestimmt zu gestalten.
1781,Wir wollen EU-weit die sozialeAufwärtskonvergenz befördern, den Binnenmarkt vervollständigen, die Säule sozialer Rechteumsetzen und soziale Ungleichheiten bekämpfen.
1782,Hierzu werden wir auch die europäischenKoordinierungsprozesse wie das Europäische Semester, nutzen.
1783,Tarifautonomie, Tarifpartner undTarifbindung sowie die sozialen Sicherungssysteme in der EU und den Mitgliedstaten wollen wirvertragsgemäß stärken.
1784,Wir wollen demokratische Mitbestimmung auf europäischer Ebene undeuropäische Betriebsräte fördern und wirkungsvoll weiterentwickeln.
1785,Auch bei grenzüberschreitendenUmwandlungen, Verschmelzungen und Spaltungen von Gesellschaften müssen nationaleBeteiligungsrechte respektiert und gesichert werden.
1786,Der Europäische Sozialfonds ist ein wichtigesInstrument, um soziale Inklusion zu fördern.
1787,Wo nötig, müssen bürokratische Hürden abgebautwerden.
1788,Wir wollen Kinderarmut bekämpfen und einen Schwerpunkt auf die Chancen und Teilhabevon Kindern und Jugendlichen legen.Unser Ziel ist die Verringerung der Lohnungleichheit zwischen Frauen und Männern europaweit.
1789,Wirunterstützen als eine Maßnahme die EU-Richtlinie für Lohntransparenz.
1790,Eine ehrgeizige Ausgestaltungmuss die Situation möglichst vieler Frauen erfassen, bürokratiearm und mittelstandskonformumgesetzt werden und ein nach Betriebsgrößen und Leistung gestaffeltes Berichtssystem vorsehen.Wir setzen uns für eine Ausgestaltung ein, die Deutschland nicht zur Einführung einesVerbandsklagerechts zwingt, sondern ermöglicht, dass wir Arbeitnehmerinnen und Arbeitnehmern dieDurchsetzung ihrer individuellen Arbeitnehmerrechte durch Verbände im Wege derProzessstandschaft ermöglichen.Krisenfestes EuropaWir setzen uns für einen starken EU-Katastrophenschutz, gemeinsame Beschaffung, Koordinierung derProduktion kritischer Güter sowie die Reduktion kritischer Importprodukte ein.
1791,Um die EUGesundheitsbehörden krisenfest zu machen, statten wir diese mit den erforderlichen Kompetenzenund Ressourcen aus.
1792,Die Potenziale des Europäischen Gesundheitsdatenraumes sollen bei Wahrung 135von Datenschutz und Patientensouveränität erschlossen und der Kampf gegen Antibiotikaresistenzverstärkt werden.Europapolitische KoordinierungWir wollen eine aktive Europapolitik betreiben und haben einen konstruktiven Gestaltungsanspruch,zu dem auch gehört, uns durch eine stringentere Koordinierung eindeutig und frühzeitig zu Vorhabender Europäische Kommission zu positionieren.
1793,Im nationalen Gesetzgebungsprozess wird wie bisherdie Europakonformität geprüft, ebenso wie die Frage, ob geplante nationale Maßnahmen aufeuropäischer Ebene zielführender umgesetzt werden können.
1794,Europäische Vorhaben prüfen wir aufihre Subsidiarität.Wir werden europäisches Recht bürokratiearm und bürgernah umsetzen.
1795,Ebenso machen wir uns aufeuropäischer Ebene für mittelstandsfreundliche Lösungen stark (KMU-Test).Europäische Außen- und SicherheitspolitikDas außenpolitische Engagement der EU ist dem Frieden, den internationalen Menschenrechten undder Konfliktvermeidung verpflichtet.
1796,Unser Ziel ist eine souveräne EU als starker Akteur in einer vonUnsicherheit und Systemkonkurrenz geprägten Welt.
1797,Wir setzen uns für eine echte GemeinsameAußen-, Sicherheits- und Verteidigungspolitik in Europa ein.
1798,Die EU muss internationalhandlungsfähiger und einiger auftreten.
1799,Wir wollen deshalb die Einstimmigkeitsregel im EUMinisterrat in der Gemeinsamen Außen- und Sicherheitspolitik (GASP) durch Abstimmungen mitqualifizierter Mehrheit ersetzen und dafür mit unseren Partnern einen Mechanismus entwickeln, umauch die kleineren Mitgliedstaaten auf diesem Weg angemessen zu beteiligen.
1800,Den EuropäischenAuswärtigen Dienst gilt es zu reformieren und zu stärken, einschließlich der Rolle der HohenVertreterin bzw.
1801,des Hohen Vertreters als echte „EU-Außenministerin“ bzw.
1802,echtem „EUAußenminister“.Wir stehen für einen umfassenden Sicherheitsbegriff.
1803,Krisenprävention und ziviles Krisenmanagementwerden wir in besonderer Weise stärken, u. a. mehr ziviles Personal entsenden.
1804,Dem EuropeanInstitute of Peace werden wir beitreten und das Exzellenzzentrum für zivile GSVP-Missionen in dieinstitutionelle Förderung überführen.Wir werden die Arbeiten am „Strategischen Kompass“ konstruktiv mitgestalten, um Ziele und Mittelder EU im Bereich Sicherheit und Verteidigung ambitioniert als Teil des Integrierten Ansatzesauszugestalten.
1805,Wir treten für eine verstärkte Zusammenarbeit nationaler Armeen 136integrationsbereiter EU-Mitglieder ein, vor allem bei Ausbildung, Fähigkeiten, Einsätzen undAusrüstung, so wie z.
1806,B. von Deutschland und Frankreich bereits geplant.
1807,Hierfür wollen wirgemeinsame Kommandostrukturen und ein gemeinsames zivil-militärisches Hauptquartier schaffen.Bei allen diesen Schritten muss die Interoperabilität und die Komplementarität mitKommandostrukturen und Fähigkeiten der NATO gesichert bleiben.
1808,Zivile und militärische Missionender EU betten wir stets in ein politisches Gesamtkonzept ein, das Konfliktursachen berücksichtigt, eineExit-Strategie vorsieht und parlamentarisch kontrolliert wird.
1809,Bei der Zwischenevaluierung derVerordnung des Verteidigungsfonds soll das EP Mitsprache- und Kontrollrechte erhalten.Europäische PartnerUns leitet eine starke deutsch-französische Partnerschaft, die den Vertrag von Aachen und dieDeutsch-Französische Parlamentarische Versammlung mit Leben füllt, z.
1810,B. durch einen neuenstrategischen Dialog.
1811,Ferner treiben wir erweiterte Formate wie das Weimarer Dreieck mit konkretenProjekten voran.
1812,Deutschland und Polen verbindet eine tiefe Freundschaft.
1813,Wir stärken hier die Arbeitder zivilgesellschaftlichen Akteure (z.
1814,B. Deutsch-Polnisches Jugendwerk).
1815,Wir verbessern dieZusammenarbeit in Grenzräumen, z.
1816,B. durch Grenzscouts, Regionalräte und Experimentierklauseln.Wir unterstützen den EU-Beitrittsprozess der sechs Staaten der Westbalkanregion und die hierfürnotwendigen Reformen zur Erfüllung aller Kopenhagener Kriterien.
1817,In diesem Rahmen stärken wir dieZivilgesellschaft und unterstützen weitere Heranführungsschritte.
1818,Als Nächstes müssen die ersten EUBeitrittskapitel mit Albanien und Nordmazedonien eröffnet, die Visaliberalisierung mit Kosovobeschlossen und die Verhandlungen mit Montenegro und Serbien fortgesetzt werden.
1819,Wirunterstützen den EU-geführten Normalisierungsdialog zwischen Kosovo und Serbien und dieBemühungen um dauerhaften Frieden in Bosnien und Herzegowina, aufbauend auf der Wahrung derterritorialen Integrität und der Überwindung ethnischer Spaltung.
1820,Parallel zu denBeitrittsverhandlungen muss die EU ihre Aufnahmefähigkeit verbessern.Wir bekennen uns zu einer gemeinsamen europäischen Politik gegenüber dem Vereinigten Königreichund streben in diesem Rahmen eine enge bilaterale Zusammenarbeit an.
1821,Wir bestehen auf dievollständige Einhaltung der beschlossenen Abkommen, insbesondere bezüglich desNordirlandprotokolls und des Karfreitagsabkommens.
1822,Bei Nicht-Einhaltung der vereinbartenStandards und Verfahren setzen wir auf eine konsequente Anwendung aller vereinbarten Maßnahmenund Gegenmaßnahmen.
1823,Wir wollen unsere Anstrengungen in der Jugend-, Kultur- und Bildungspolitikin einem gemeinsamen europäischen Rahmen ausrichten, ggf.
1824,auch unter Einschluss der regionalenEbenen.
1825,137Europäische FreizügigkeitDie Freizügigkeit gehört zu den zentralen Errungenschaften der EU.
1826,Sie zu verteidigen und fair zugestalten, ist uns wichtig.
1827,Die Integrität des Schengenraums wollen wir wiederherstellen undAusnahmeregelungen restriktiver und nicht ohne Konsultationen unserer europäischen Partnernutzen.
1828,Bei zukünftigen Erweiterungen des Schengenraums wollen wir neben den bestehendenSicherheitskriterien auch besonderes Augenmerk auf die Einhaltung von Rechtsstaatlichkeit undhumanitäre Standards legen.
1829,Wir wollen die Bildungsfreizügigkeit in der EU stärken.
1830,Wir braucheneinen Digitalisierungsschub zum Abbau von Bürokratie, zur einfachen Handhabung von Freizügigkeit,schnelleren Geltendmachung bestehender Ansprüche sowie zur Erleichterung des Kampfs gegenBetrug und Missbrauch.
1831,Daher unterstützen wir einen neuen Anlauf zur Einführung einer EuropäischenSozialversicherungsnummer, auch um die Geltendmachung bestehender Portabilitätsansprüche zuerleichtern.In den Mitgliedstaaten haben sich insbesondere bei freien Berufen unterschiedliche Systeme vonLeistungserbringung, Selbstverwaltung und Selbstkontrolle herausgebildet.
1832,Diese Unterschiede gilt esbei Rechtsakten der EU zu berücksichtigen.
1833,Wir wollen eine Informationsplattform in allen EUSprachen zu Altersvorsorgesystemen, Sozialversicherungsansprüchen, Besteuerung und Portabilitätsowie Informationen zum Arbeitsrecht in den Mitgliedstaaten.
1834,Wir wollen europaweit einerichtlinienkonforme Umsetzung der Entsenderichtlinie sowie deren einfache Handhabung undDurchsetzung zum Schutz entsandter Beschäftigter und effektive und effiziente Kontrollen, um gegenMissbrauch und Betrug vorgehen zu können.
1835,Dazu wollen wir eine bürokratiearme Umsetzung desdeutschen Arbeitnehmer-Entsendegesetzes, eine gute Ausstattung der Kontrollbehörden und breiteBeratungsangebote für entsandte und mobile Beschäftigte.
1836,Bestimmte Dienstreisen wollen wir vonder Notifizierungspflicht zur A1-Bescheinigung ausnehmen, wenn vor Ort keine Dienstleistungenerbracht oder Güter veräußert werden.
1837,Wir wollen die Europäische Arbeitsbehörde nutzen, umgeltendes Recht durchzusetzen und Kontrollen besser zu koordinieren.
1838,Dazu braucht es ein klaresMandat, das Mitgliedstaaten zur Kooperation und gegenseitigen grenzüberschreitende Auskunft undInspektionen anhält.Integration, Migration, FluchtWir wollen einen Neuanfang in der Migrations- und Integrationspolitik gestalten, der einem modernenEinwanderungsland gerecht wird.
1839,Dafür brauchen wir einen Paradigmenwechsel: Mit einer aktiven und 138ordnenden Politik wollen wir Migration vorausschauend und realistisch gestalten.
1840,Wir werdenirreguläre Migration reduzieren und reguläre Migration ermöglichen.
1841,Wir stehen zu unsererhumanitären Verantwortung und den Verpflichtungen, die sich aus dem Grundgesetz, der GenferFlüchtlingskonvention (GFK), der Europäischen Menschenrechtskonvention (EMRK) und demEuroparecht ergeben, um Geflüchtete zu schützen und Fluchtursachen zu bekämpfen.Aufenthalts- und BleiberechtWir wollen die Visavergabe beschleunigen und verstärkt digitalisieren.
1842,Auch um transnationaleArbeitsmigration zu ermöglichen, wollen wir, dass Aufenthaltsgenehmigungen nicht beivorübergehenden Auslandsaufenthalten erlöschen.
1843,Wir streben ein in sich stimmiges,widerspruchsfreies Einwanderungsrecht an, das anwenderfreundlich und systematisiert idealerweisein einem Einwanderungs- und Aufenthaltsgesetzbuch zusammengefasst wird.Wir werden das komplizierte System der Duldungstatbestände ordnen und neue Chancen fürMenschen schaffen, die bereits ein Teil unserer Gesellschaft geworden sind: Gut integrierteJugendliche sollen nach drei Jahren Aufenthalt in Deutschland und bis zum 27.
1844,Lebensjahr dieMöglichkeit für ein Bleiberecht bekommen (§ 25a Aufenthaltsgesetz, AufenthG).
1845,BesondereIntegrationsleistungen von Geduldeten würdigen wir, indem wir nach sechs bzw.
1846,vier Jahren beiFamilien ein Bleiberecht eröffnen (§ 25b AufenthG).Der bisherigen Praxis der Kettenduldungen setzen wir ein Chancen-Aufenthaltsrechtentgegen: Menschen, die am 1.
1847,Januar 2022 seit fünf Jahren in Deutschland leben, nicht straffälliggeworden sind und sich zur freiheitlichen demokratischen Grundordnung bekennen, sollen eineeinjährige Aufenthaltserlaubnis auf Probe erhalten können, um in dieser Zeit die übrigenVoraussetzungen für ein Bleiberecht zu erfüllen (insbesondere Lebensunterhaltssicherung undIdentitätsnachweis gemäß §§ 25 a und b AufenthG).Wir wollen Geduldeten in der Ausbildung und ihren Betrieben mehr Rechtssicherheit durch eineAufenthaltserlaubnis (§ 60 c AufenthG) verleihen.
1848,Die Beschäftigungsduldung wollen wir entfristen undAnforderungen realistisch und praxistauglicher fassen.
1849,Die „Duldung light“ schaffen wir ab.
1850,TragenGeduldete nicht zur Klärung ihrer Identität bei, wird der Zeitraum der Duldung nicht für ein Bleiberechtangerechnet.
1851,Wir werden die Klärung der Identität einer Ausländerin oder eines Ausländers um dieMöglichkeit, eine Versicherung an Eides statt abzugeben, erweitern und werden hierzu einegesetzliche Regelung im Ausländerrecht schaffen.
1852,139Arbeitsverbote für bereits in Deutschland Lebende schaffen wir ab.
1853,Einem an sich bestehendenAnspruch auf Erteilung einer Aufenthaltserlaubnis steht ein laufendes Asylverfahren nicht entgegen,sofern bei Einreise die Voraussetzungen für die Aufenthaltserlaubnis bereits vorlagen.Wir wollen eine präzisere Regelung für Opfer häuslicher oder partnerschaftlicher Gewalt, die nur einabgeleitetes Aufenthaltsrecht besitzen.
1854,Auch Opfer von Menschenhandel sollen ein Aufenthaltsrechtunabhängig von ihrer Aussagebereitschaft erhalten.IntegrationFür eine möglichst rasche Integration wollen wir für alle Menschen, die nach Deutschland kommenvon Anfang an Integrationskurse anbieten.
1855,Die Kurse müssen passgenau und erreichbar sein.
1856,DieBedingungen für Kursträger, Lehrende und Teilnehmende wollen wir verbessern.
1857,Kinder undJugendliche sollen schnell Zugang zu Bildung bekommen.
1858,Deswegen wollen wir schulnahe Angebotekurz nach ihrer Ankunft in Deutschland.Wir wollen eine Verstetigung der Beteiligung des Bundes an den flüchtlingsbezogenen Kosten derLänder und Kommunen und zudem die Unterstützung des Bundes in Form der Mittel, die fürIntegration verwendet werden, fortsetzen.
1859,Dabei wollen wir insbesondere rechtskreisübergreifende,vernetzte Kooperation in der kommunalen Integrationsarbeit (finanziell) stärken undweiterentwickeln.
1860,Wir schaffen ein Bundesprogramm zu Stärkung der gesellschaftlichen Teilhabe undIntegration von Menschen aus (Süd)ost-Europa.Die Migrationsberatung des Bundes (Jugendmigrationsdienste, Migrationsberatung für erwachseneZuwanderinnen und Zuwanderer) und die Migrantenselbstorganisationen werden wir angemessenfördern.
1861,Für eine schnelle und nachhaltige Arbeitsmarktintegration werden wir die auf denIntegrationskursen aufbauenden Berufssprachkurse stärker fördern und die Mittel verstetigen.Die Meldepflichten von Menschen ohne Papiere wollen wir überarbeiten, damit Kranke nicht davonabgehalten werden, sich behandeln zu lassen.
1862,Wir halten es für erforderlich, die psychosoziale Hilfefür geflüchtete Menschen zu verstetigen.AsylverfahrenAsylverfahren müssen fair, zügig und rechtssicher ablaufen.
1863,Für schnellere Verfahren wollen wir dasBundesamts für Migration und Flüchtlinge (BAMF) entlasten.
1864,Deshalb wird die Widerrufsprüfungkünftig wieder anlassbezogen erfolgen.
1865,Auch werden wir dafür sorgen, dass Verwaltungsgerichte 140durch qualitativ hochwertige Entscheidungen des BAMF entlastet werden.
1866,Wir wollen schnellereEntscheidungen in Asylprozessen sowie eine Vereinheitlichung der Rechtsprechung und werden dazuzügig einen Gesetzentwurf vorlegen.
1867,Weiter führen wir eine flächendeckende, behördenunabhängigeAsylverfahrensberatung ein, um mit informierten Antragstellerinnen und Antragstellern für eineVerfahrensbeschleunigung zu sorgen.
1868,Vulnerable Gruppen wollen wir von Anfang an identifizieren undbesonders unterstützen.Das Konzept der AnkER-Zentren wird von der Bundesregierung nicht weiterverfolgt.Familienzusammenführung muss im Sinne der Integration und der Aufnahmefähigkeit der Gesellschaftgestaltet werden.
1869,Wir werden die Familienzusammenführung zu subsidiär Geschützten mit den GFKFlüchtlingen gleichstellen.
1870,Wir werden beim berechtigten Elternnachzug zu unbegleitetenMinderjährigen die minderjährigen Geschwister nicht zurücklassen.
1871,Zum Ehepartner oder zurEhepartnerin nachziehende Personen können den erforderlichen Sprachnachweis auch erstunverzüglich nach ihrer Ankunft erbringen.Wir werden das Asylbewerberleistungsgesetz im Lichte der Rechtsprechung desBundesverfassungsgerichts weiterentwickeln.
1872,Wir wollen den Zugang für Asylbewerberinnen undAsylbewerber zur Gesundheitsversorgung unbürokratischer gestalten.
1873,Minderjährige Kinder sind vonLeistungseinschränkungen bzw.
1874,-kürzungen auszunehmen.Nicht jeder Mensch, der zu uns kommt, kann bleiben.
1875,Wir starten eine Rückführungsoffensive, umAusreisen konsequenter umzusetzen, insbesondere die Abschiebung von Straftätern und Gefährdern.Der Bund wird die Länder bei Abschiebungen künftig stärker unterstützen.
1876,Wir werden unsererbesonderen humanitären Verantwortung gerecht und Kinder und Jugendliche grundsätzlich nicht inAbschiebehaft nehmen.
1877,Die freiwillige Ausreise hat stets Vorrang.
1878,Die staatliche Rückkehrförderungfür Menschen ohne Bleiberecht wollen wir finanziell besser ausstatten.
1879,Um freiwillige Ausreisen zufördern, wollen wir staatliche und unabhängige Rückkehrberatung systematisieren und stärken.
1880,Wirstreben an, dass die zuständige oberste Bundesbehörde für einzelne Herkunftsländer einentemporären nationalen Abschiebestopp erlassen kann.Asylanträge aus Ländern mit geringen Anerkennungsquoten werden zur Verfahrensbeschleunigungpriorisiert.
1881,141Europäische und internationale FlüchtlingspolitikWir wollen neue praxistaugliche und partnerschaftliche Vereinbarungen mit wesentlichenHerkunftsländern unter Beachtung menschenrechtlicher Standards schließen.
1882,Diese Vereinbarungensollen ein Gesamtkonzept umfassen wie z.
1883,B. den Ausbau von wirtschaftlicher Zusammenarbeit,Technologie-Transfer, Visa-Erleichterungen, Qualifizierungsmaßnahmen für den deutschenArbeitsmarkt, Jobbörsen und die Zusammenarbeit bei der Rückkehr abgelehnter Asylsuchender.
1884,DerAbschluss möglicher Abkommen wird nicht von finanzieller Unterstützung im Rahmen derEntwicklungszusammenarbeit abhängig gemacht.
1885,Zur Gestaltung solcher Migrationsabkommen setztdie Bundesregierung einen Sonderbevollmächtigten ein.Wir setzen uns für eine grundlegende Reform des Europäischen Asylsystems ein.
1886,Unser Ziel ist einefaire Verteilung von Verantwortung und Zuständigkeit bei der Aufnahme zwischen den EU-Staaten.Wir wollen bessere Standards für Schutzsuchende in den Asylverfahren und bei der Integration in denEU-Staaten.
1887,Wir wollen irreguläre Migration wirksam reduzieren und Ursachen für dielebensgefährliche Flucht bekämpfen.
1888,Wir wollen die illegalen Zurückweisungen und das Leid an denAußengrenzen beenden.Der Asylantrag von Menschen, die in der EU ankommen oder bereits hier sind, muss inhaltlich geprüftwerden.
1889,Die EU und Deutschland dürfen nicht erpressbar sein.
1890,Wir wollen verhindern, dass Menschenfür geopolitische oder finanzielle Interessen instrumentalisiert werden.
1891,Deshalb setzen wir uns fürrechtsstaatliche Migrationsabkommen mit Drittstaaten im Rahmen des Europa- und Völkerrechts ein.Wir werden hierfür prüfen, ob die Feststellung des Schutzstatus in Ausnahmefällen unter Achtung derGFK und EMRK in Drittstaaten möglich ist.Auf dem Weg zu einem gemeinsamen funktionierenden EU-Asylsystem wollen wir mit einer Koalitionder aufnahmebereiten Mitgliedstaaten vorangehen und aktiv dazu beitragen, dass andere EU-Staatenmehr Verantwortung übernehmen und EU-Recht einhalten.
1892,Die Aufnahmebereitschaft in Deutschlandund der EU wollen wir stützen und fördern.Wir wollen, dass Frontex auf Grundlage der Menschenrechte und des erteilten Mandats zu einerechten EU-Grenzschutzagentur weiterentwickelt wird.
1893,Das Ziel muss ein wirksamer undrechtsstaatlicher Außengrenzschutz sein, der transparent ist und parlamentarisch kontrolliert wird.Frontex soll sich im Rahmen des Mandats bei der Seenotrettung aktiv beteiligen.
1894,142Wir wollen Sekundärmigration in der EU reduzieren.
1895,Dazu wollen wir den Missbrauch der visafreienReise verhindern und durch ein geordnetes Relocation-Programm dazu beitragen, dassAußengrenzstaaten die Bedingungen für Geflüchtete in ihren Ländern verbessern.Es ist eine zivilisatorische und rechtliche Verpflichtung, Menschen nicht ertrinken zu lassen.
1896,Die zivileSeenotrettung darf nicht behindert werden.
1897,Wir streben eine staatlich koordinierte und europäischgetragene Seenotrettung im Mittelmeer an und wollen mit mehr Ländern Maßnahmen wie den MaltaMechanismus weiterentwickeln.
1898,Wir streben eine faire Verantwortungsteilung zwischen denAnrainerstaaten des Mittelmeers bei der Seenotrettung an und wollen sicherstellen, dass Menschennach der Rettung an sichere Orte gebracht werden.Wir wollen die Ursachen von Flucht angehen, damit Menschen in Sicherheit und Würde leben können.Wir werden zudem die ausbeuterischen Verhältnisse auf den Fluchtwegen und Schleuserkriminalitätbekämpfen.Besonders in der Verantwortung stehende Aufnahme- und Transitländer von Geflüchteten wollen wirdauerhaft unterstützen, um für die Menschen und die aufnehmenden Gemeinden nachhaltigePerspektiven zu schaffen.
1899,Wir werden unseren Beitrag zu einer verlässlichen Finanzierung humanitärerOrganisationen leisten.Wir werden die geordneten Verfahren des Resettlement anhand der vom UNHCR gemeldeten Bedarfeverstärken.
1900,Wir werden ein humanitäres Aufnahmeprogramm des Bundes in Anlehnung an die bisherim Zuge des Syrien-Krieges durchgeführten Programme verstetigen und diese jetzt für Afghanistannutzen.Wir werden unsere Verbündeten nicht zurücklassen.
1901,Wir wollen diejenigen besonders schützen, dieder Bundesrepublik Deutschland im Ausland als Partner zur Seite standen und sich für Demokratie undgesellschaftliche Weiterentwicklung eingesetzt haben.
1902,Deswegen werden wir das Ortskräfteverfahrenso reformieren, dass gefährdete Ortskräfte und ihre engsten Familienangehörigen durchunbürokratische Verfahren in Sicherheit kommen.Wir werden humanitäre Visa für gefährdete Personen ermöglichen und dazu digitaleVergabeverfahren einführen.
1903,143Außen, Sicherheit, Verteidigung, Entwicklung, MenschenrechteUnsere Außen-, Sicherheits- und Entwicklungspolitik werden wir wertebasiert und europäischeraufstellen.
1904,Die deutsche Außenpolitik soll aus einem Guss agieren und ressortübergreifendgemeinsame Strategien erarbeiten, um die Kohärenz unseres internationalen Handelns zu erhöhen.Gemeinsam mit unseren Partnern, auch aus der Zivilgesellschaft, werden wir uns für die Bewahrungunserer freiheitlichen Lebensweise in Europa und den Schutz von Frieden und Menschenrechtenweltweit einsetzen.
1905,Dabei leiten uns unsere Werte und Interessen.Die strategische Souveränität Europas wollen wir erhöhen.
1906,Ziel ist eine multilaterale Kooperation inder Welt, insbesondere in enger Verbindung mit denjenigen Staaten, die unsere demokratischenWerte teilen.
1907,Dabei geht es auch um den Systemwettbewerb mit autoritär regierten Staaten und einestrategische Solidarität mit unseren demokratischen Partnern.Die Menschenrechte als wichtigster Schutzschild der Würde des Einzelnen bilden dabei unserenKompass.
1908,Das transatlantische Bündnis ist zentraler Pfeiler und die NATO unverzichtbarer Teil unsererSicherheit.
1909,Unsere Soldatinnen und Soldaten leisten einen unentbehrlichen Beitrag zum Schutzunseres Landes, für Frieden und internationale Sicherheit.Wir setzen uns für eine Wiederbelebung der internationalen Abrüstung und Rüstungskontrolle ein.Unsere Sicherheit und der Schutz unserer Lebensgrundlagen erfordern globale Zusammenarbeit, eineStärkung der Vereinten Nationen sowie eine regelbasierte internationale Ordnung.
1910,Wir setzen unsinsbesondere für eine gemeinsame, konsequente Klimaaußenpolitik und Klimagerechtigkeit im Sinnedes European Green Deal, der Agenda 2030 und des Pariser Klimaabkommens ein.Der Einsatz für Frieden, Freiheit, Menschenrechte, Demokratie, Rechtsstaatlichkeit und Nachhaltigkeitist für uns ein unverzichtbarer Teil einer erfolgreichen und glaubwürdigen Außenpolitik fürDeutschland und Europa.MultilateralismusWir setzen uns für die Stärkung der Vereinten Nationen (VN) als wichtigster Institution derinternationalen Ordnung politisch, finanziell und personell ein.
1911,Eine Reform des VN-Sicherheitsratesbleibt ebenso unser Ziel wie eine gerechtere Repräsentanz aller Weltregionen.
1912,Wir unterstützen undstärken Initiativen wie die Allianz der Demokratien, die Allianz für den Multilateralismus entwickelnwir weiter.
1913,Wir setzen uns auch über unseren G7-Vorsitz für die Stärkung des Multilateralismus ein.
